video_id,comment,toxicity,severe_toxicity,obscene,identity_attack,insult,threat,sexual_explicit
7526035089956949270,Is it in?,0.0004942488158121705,2.1606874724966474e-05,0.00013280224811751395,8.804176468402147e-05,0.00020570572814904153,3.678198845591396e-05,2.3543860152130947e-05
7526035089956949270,people caught having too much fun in public is the search🥀,0.0020793708972632885,5.0503789680078626e-05,0.0005245170905254781,0.00021036952966824174,0.00029621878638863564,7.932065636850893e-05,0.00016912522551137954
7526035089956949270,Is it in yet 😭🥀🥀🥀🥀🥀,0.0003868763451464474,0.0005518252728506923,0.004312979988753796,0.0008707622764632106,0.0033266700338572264,0.0002876065846066922,0.00014913098129909486
7526035089956949270,They are just kissing,0.02315424755215645,0.00011593637464102358,0.0019575338810682297,0.000568666378967464,0.0030216302257031202,0.0018956231651827693,0.0012570363469421864
7526035089956949270,Even the arrow is pointing on them 💔😭,0.0015416133683174849,3.7432277167681605e-05,0.0001944699906744063,0.00017366712563671172,0.00022012059343978763,0.00026544963475316763,4.438820542418398e-05
7526978795744644385,New bugatti,0.13859184086322784,0.0002212813269579783,0.010096441954374313,0.00034097276511602104,0.10152629017829895,0.001396910403855145,0.0011789549607783556
7526978795744644385,AVETE FATTO I COMPITI DELLE VACANZE?😜📚,0.04724154621362686,0.000561864988412708,0.01418998558074236,0.0008771986467763782,0.022823626175522804,0.0008458831580355763,0.000955344527028501
7526978795744644385,come state ragazzi e ragazze,0.00777951255440712,9.566736844135448e-05,0.0008707327651791275,0.0005632418906316161,0.0037952540442347527,0.00020564433361869305,0.00033478758996352553
7526978795744644385,"una fi loro sarà pure imvalida ma le altre,?",0.21386787295341492,0.0004192656197119504,0.004816094879060984,0.001359704416245222,0.16861991584300995,0.0056429277174174786,0.0007461082423105836
7526978795744644385,Mi fa morire che per tutti i passanti risulta normale 😅❤️,0.005146373994648457,0.00010156037023989484,0.0019244920695200562,0.000267739495029673,0.0010253159562125802,0.0004150881723035127,0.00014686406939290464
7526978795744644385,"""che ragazze misteriose chissà con che macchina sono venute""
la macchina:🛵👸👸👸",0.010669098235666752,0.005748368334025145,0.04180417209863663,0.00882467906922102,0.024023745208978653,0.0014592527877539396,0.003916179295629263
7526978795744644385,Guildford???,0.0006872869562357664,2.744035009527579e-05,0.00020283217600081116,0.00011144640302518383,0.00026338367024436593,7.183724665082991e-05,3.585452577681281e-05
7526978795744644385,no vabbe ma quella che guida? ahahahaha guida come se nulla fosse la adoro😂😂😂 e la 3 è appoato messa cosi😂😂😂,0.002150127664208412,6.585955998161808e-05,0.0018287802813574672,0.00016569953004363924,0.0008616425329819322,6.64343242533505e-05,0.00011483576236059889
7526978795744644385,"Mi state simpatiche, vi compro",0.006510549690574408,0.00039367860881611705,0.007055328227579594,0.0007377427536994219,0.006445195060223341,0.0006518438458442688,0.0004399794270284474
7526978795744644385,MA È GUILFORD,0.25359511375427246,0.0033536364790052176,0.03508244454860687,0.004586571361869574,0.055815085768699646,0.0030701595824211836,0.0036608863156288862
7525124533863451926,DID HE JUST EAT THAT CICADA,0.7211543917655945,0.008719203062355518,0.20534585416316986,0.003037238959223032,0.08575780689716339,0.08431392163038254,0.011053875088691711
7525124533863451926,Why are dog eat cicada,0.022655965760350227,4.686488682636991e-05,0.0012510194210335612,0.00022040073235984892,0.009450585581362247,0.00012365241127554327,7.812063995515928e-05
7525124533863451926,Does this hurt the cicada?,0.0015350035391747952,5.535003947443329e-05,0.0005370349390432239,0.00011788198025897145,0.00032783360802568495,0.00020350166596472263,0.0001485731772845611
7525124533863451926,cicala no cicada,0.023285405710339546,0.0003998666943516582,0.0040688468143343925,0.00030807332950644195,0.0046744090504944324,0.01036318764090538,0.006012408994138241
7525124533863451926,I’m a vet and you have to be very careful letting your dog eat a cicada. The gases released once ingested are very dangerous and have been known to cause the sudden growth of wings on dogs that generate the same annoying sound.,0.0012469151988625526,3.0294610041892156e-05,0.00036166724748909473,8.214539411710575e-05,0.0003620255156420171,5.710982077289373e-05,6.60971345496364e-05
7525124533863451926,bro how he act like he has not eat Cicada 😭,0.0015716435154899955,2.717192910495214e-05,0.00033749500289559364,0.00015121356409508735,0.0005889415624551475,5.574281021836214e-05,3.328411185066216e-05
7525124533863451926,“Why are dogs eat cicada”💔🥀,0.0013813338009640574,1.4875475244480185e-05,0.00010354598634876311,0.00011346135579515249,0.0005316358292475343,2.3397031327476725e-05,1.797230652300641e-05
7525124533863451926,Why was that cicada CRUNCHY,0.03629439324140549,0.00023388148110825568,0.008556922897696495,0.0005387245328165591,0.007361364085227251,0.0004295135731808841,0.000727314967662096
7525124533863451926,"Butterflies in stomach ❎
Cicadas in stomach ✅",0.0334276519715786,0.0003489473892841488,0.006212987471371889,0.000446776975877583,0.005018701311200857,0.0018605694640427828,0.0035452330484986305
7525124533863451926,Poor Cicada 😭,0.001355024753138423,2.3361402782029472e-05,0.00023918645456433296,0.0001110393859562464,0.0005009211599826813,6.170171400299296e-05,2.6290012101526372e-05
7526172149518732566,chissà se Grelmoss mi saluta...😍😘,0.002389234956353903,0.0002664380008354783,0.003051521722227335,0.0004602668632287532,0.0007220952538773417,0.0003669159486889839,0.00014227331848815084
7526172149518732566,se grelmos mi risponde mi dichiaro a crush,0.7320594787597656,0.010307916440069675,0.07554523646831512,0.007921065203845501,0.032104454934597015,0.04891598969697952,0.02220710925757885
7526172149518732566,Latina final boss,0.021109160035848618,0.00012519059237092733,0.003009640844538808,0.003659232519567013,0.0048506432212889194,0.00017057180230040103,0.0009044980397447944
7526172149518732566,ogni volta che vedo grelmoss [photo],0.01680457592010498,0.0009409863851033151,0.018465155735611916,0.002381455386057496,0.009047018364071846,0.0007769446237944067,0.0012208260595798492
7528097665817595158,"è illegale per legge, non perché lo dico io.",0.0023503173142671585,0.000350339018041268,0.0058844736777246,0.0009725893032737076,0.004482310265302658,0.00021883007138967514,0.00016572260938119143
7528097665817595158,"Quel tuffo in mezzo alle ceneri mi ha fatto sentire tutto il dolore di questa persona ma sopratutto l'amore che in vita lui 🐶 ha dato a loro. Non si puo spiegare questo dolore. Quando e successo a noi mi hanno sentita urlare nel raggio di 50m quel ""Nooooo, amore mio, noooooo"" con tutta la mia forza. Sono scesi gli operai dal tetto della casa vicino e mi hanno chiesto cosa fosse successo dentro casa ma io ero fuori, davanti alla sua cuccia in ginocchio che la accarezzavo. Dopo 9 anni lei è ancora qui con noi (seppellita proprio in giardino) nei nostri ricordi. ❤️🥺",0.0040758708491921425,4.032395372632891e-05,0.0013687595492228866,8.538988913642243e-05,0.0008673794800415635,8.95003613550216e-05,0.0003947007062379271
7528097665817595158,Cioè il cane gli ha chiesto di essere cremato e sparse le ceneri ?,0.003123440546914935,5.3979518270352855e-05,0.00047329883091151714,0.00013411440886557102,0.0006808160687796772,0.0006062461761757731,0.00017639494035393
7528097665817595158,"Sì, è possibile disperdere le ceneri di un defunto in mare in Italia, ma è necessario seguire alcune disposizioni di legge e regolamenti specifici. 
Cosa dice la legge:
La dispersione delle ceneri è consentita in mare, a patto che avvenga ad almeno mezzo miglio dalla costa e lontano da centri abitati e zone di balneazione. 
È necessario ottenere l'autorizzazione dall'Ufficiale di Stato Civile del comune in cui è avvenuto il decesso. 
La dispersione può essere effettuata dal coniuge, da altri familiari aventi diritto, dall'esecutore testamentario o da personale autorizzato dal comune. 
È vietato disperdere le ceneri in zone di rispetto per la captazione o derivazione di acque destinate al consumo umano.",0.0003703625698108226,2.91943706542952e-05,0.00017947336891666055,8.21783032733947e-05,0.00019288535986561328,3.849404674838297e-05,3.3887259633047506e-05
7528097665817595158,Il gesto è bellissimo. Solo non capisco come abbia fatto a chiedertelo.,0.0007827974040992558,4.292689118301496e-05,0.0005936906673014164,0.00011228312359889969,0.0006013746606186032,5.903236160520464e-05,4.9200312787434086e-05
7528097665817595158,They swimm for the last time together ❤️,0.0010885264491662383,4.7548648581141606e-05,0.000349594367435202,0.00020558806136250496,0.00017789180856198072,0.00011895754869328812,6.575983570655808e-05
7528097665817595158,"I know you loved your dog, and I mean no disrespect, but turning such a loyal companion into ashes feels really sad to me. I believe animals deserve a natural return to the earth buried in peace, not burned. I hope one day people reflect more deeply on how we say goodbye to those who gave us unconditional love.",0.0007846824591979384,1.3834864148520865e-05,0.00010840695176739246,6.115476571721956e-05,0.00029720435850322247,2.666807449713815e-05,2.0426006813067943e-05
7528097665817595158,I can’t delete my story,0.0009527447982691228,0.00019385073392186314,0.0009876630501821637,0.0006305952556431293,0.0006048866198398173,0.00016674958169460297,6.535597640322521e-05
7528006372076588310,Non girarlo il coperchio… c’è un gommino e serve per non rovinare la cisterna….,0.014073786325752735,0.00012527825310826302,0.0032169721089303493,0.0002197251160396263,0.004282080102711916,0.0008759883930906653,0.0011509066680446267
7528006372076588310,Where is your mask?,0.0005480146501213312,1.9145743863191456e-05,0.0001388553500873968,8.304968650918454e-05,0.0002119823475368321,3.845460378215648e-05,2.5466280931141227e-05
7528006372076588310,cioe ..entra con capelli sciolto occhiali ..x piacere,0.026432065293192863,0.0001630916667636484,0.0024664972443133593,0.00025354453828185797,0.00729892123490572,0.004812681581825018,0.003931275103241205
7528006372076588310,20€,0.00035587462480179965,2.290851261932403e-05,0.00015616971359122545,7.265307067427784e-05,0.00021559966262429953,3.631166327977553e-05,2.3920249077491462e-05
7528006372076588310,quanta esibizione mamm ro Carmen,0.006917772348970175,0.0007343789329752326,0.014343973249197006,0.0015466617187485099,0.006710715126246214,0.0005398921784944832,0.0009057300048880279
7528006372076588310,Who is this diva 💜,0.004720940720289946,1.2115307072235737e-05,0.00015907199122011662,0.00016288294864352793,0.0018999386811628938,2.0901612515444867e-05,2.0923071133438498e-05
7528006372076588310,Los comentarios: hombres a los que les dan miedo las mujeres,0.096733458340168,0.0007692203507758677,0.0018579483730718493,0.11391279846429825,0.008928987197577953,0.0019283408764749765,0.005149707198143005
7528006372076588310,What’s the point in a loose harness might aswell not have one,0.0006794050568714738,2.4003538783290423e-05,0.00016979662177618593,0.00010037163156084716,0.0002715843729674816,5.019123273086734e-05,2.5561004804330878e-05
7528006372076588310,La cintura di sicurezza deve essere aderente al corpo perché funzioni in caso di caduta e agganciata al filo vita se si vuole che ti salvi da una caduta.,0.00630432553589344,0.0001291374646825716,0.0010214282665401697,0.000153029162902385,0.0006460114964284003,0.002949013141915202,0.00024388213932979852
7526898772014632214,Annullo tutto commentando 🍀🍀🍀,0.000895180506631732,0.004216562956571579,0.03518586605787277,0.006782652344554663,0.028227370232343674,0.0017036402132362127,0.0007791715324856341
7526898772014632214,ma la gente che ci crede 🥀,0.0020964862778782845,0.0015513971447944641,0.022886060178279877,0.0028919875621795654,0.015134857967495918,0.0007300690631382167,0.00035792801645584404
7526898772014632214,Annullo 🍀🍀🍀🍀,0.0006742483237758279,0.004412616137415171,0.033610060811042786,0.005836827680468559,0.02899380400776863,0.001946341129951179,0.0009697986533865333
7526898772014632214,annullo tutte le maledizioni🍀,0.2982911169528961,0.0015832680510357022,0.03529014810919762,0.005085375625640154,0.043952371925115585,0.006472572684288025,0.001064277603290975
7526898772014632214,Manifesto al massimo per annullare🍀🍀🍀🍀🍀🍀🍀🍀🍀🍀,0.000581338768824935,0.004566865973174572,0.03674924746155739,0.00495239207521081,0.036815572530031204,0.0019750662613660097,0.0009917746065184474
7526898772014632214,Le persone che scrivono annullo😭😭😭,0.015748415142297745,0.0002626291534397751,0.005938918329775333,0.000833598431199789,0.004795792978256941,0.0007628324092365801,0.00033520659781061113
7526898772014632214,@sofia,0.0009086758363991976,1.715439611871261e-05,0.0001397918094880879,6.610381387872621e-05,0.000636312470305711,3.084017589571886e-05,1.9717968825716525e-05
7526898772014632214,an,0.002726844046264887,0.00048146425979211926,0.008156402967870235,0.0005585001781582832,0.006579170003533363,0.0006450501969084144,0.0004384535423014313
7526898772014632214,annullo tutto e manifesto al massimo 🍀🍀🍀,0.000962499063462019,0.005747510120272636,0.03788325935602188,0.0072988723404705524,0.03252552077174187,0.002347439993172884,0.0013040539342910051
7526898772014632214,annullo tutto commentandoo 🍀🍀🍀🍀🍀🍀🍀🍀🍀🍀🍀,0.0006797936512157321,0.004135807976126671,0.035176146775484085,0.00649245735257864,0.03113379515707493,0.001862560398876667,0.0009317856165580451
7528759783734693142,cercate “federico” e vi esce,0.037033673375844955,0.0002916679950430989,0.005000436212867498,0.0006190864951349795,0.010525519959628582,0.007204363122582436,0.0020712208934128284
7528759783734693142,Ho il video dei ragazzi sopra dove uno dice: “mi piacerebbe portarti in collina”@Federico,0.0041680787689983845,5.0228765758220106e-05,0.00033815039205364883,0.0002762972144410014,0.00038292165845632553,0.0007983350078575313,0.00012596654414664954
7528759783734693142,chi dal video del ragazzo????,0.0036419013049453497,0.0003753847267944366,0.006323038134723902,0.0005395459593273699,0.0036483623553067446,0.0004099629877600819,0.00037119907210581005
7528759783734693142,scendi tutti e 2 perché Andate al concerto di Ultimo,0.21880382299423218,0.002151719992980361,0.024644721299409866,0.0035883525852113962,0.0267453845590353,0.01493618730455637,0.0024846475571393967
7528759783734693142,non ho capito spiegare plisss,0.08865780383348465,0.002247191732749343,0.04910740256309509,0.0035880731884390116,0.02404162846505642,0.001445568399503827,0.0016355094267055392
7528759783734693142,entrambi che ci andate,0.008855010382831097,0.00048139155842363834,0.010297433473169804,0.000790160323958844,0.00612590741366148,0.0005866585997864604,0.0009516222053207457
7528759783734693142,chi dal video da quelli sulla collina ?,0.0014011699240654707,0.0011489464668557048,0.014704075641930103,0.0015162620693445206,0.008289591409265995,0.0006614968879148364,0.0004202908603474498
7528759783734693142,“Mi piacerebbe portarti in collina”,0.035199977457523346,0.0001465592358727008,0.0010523329256102443,0.0006205030367709696,0.0023502225521951914,0.015691278502345085,0.0005134626408107579
7528759783734693142,"mi spiegate cosa avete tutti contro ultimo?(non è il cantante migliore del mondo e a me la musica italiana non piace Neanche,però non cè bisogno di andargli contro,è bravo comq)",0.05439309775829315,0.004558852408081293,0.03886501118540764,0.010495725087821484,0.03496883064508438,0.0018003105651587248,0.0015899569261819124
7528759783734693142,"Direi tutti quanti, come fate ad ascoltare Ultimi? Mamma mij",0.044234730303287506,0.0009040439617820084,0.03007211722433567,0.0014250618405640125,0.015017230994999409,0.0005780156934633851,0.003149619558826089
7528888745299283222,Non ho capito qualcuno che spiega?,0.0005419196677394211,0.0012700320221483707,0.012276304885745049,0.0019032013369724154,0.009625999256968498,0.0006630919524468482,0.00033958544372580945
7528888745299283222,chi insulta senza spiegare??,0.005994278006255627,0.00013393830158747733,0.0032563291024416685,0.00022265886946115643,0.003927113022655249,0.0002331591967958957,0.0001970677258213982
7528888745299283222,dexter x achille lauro prima di gta 6,0.0023257711436599493,0.0010856795124709606,0.012889421544969082,0.001555684837512672,0.012258266098797321,0.0009370592888444662,0.0005664090858772397
7528888745299283222,Ma perché fa delle pause quando ride? 😅,0.002057852456346154,4.182409975328483e-05,0.0006697630160488188,0.00011683363845804706,0.0008332711877301335,0.00013716565445065498,9.783362474991009e-05
7528888745299283222,Io quando devo rifare la risata nel vocale che per sbaglio ho cancellato,0.01375348586589098,0.0055012935772538185,0.04089061915874481,0.0079794405028224,0.03655211627483368,0.0026479230728000402,0.0012070201337337494
7528888745299283222,ma è il mc di bolzano,0.00515828188508749,0.00019114385941065848,0.004872896708548069,0.0005119643174111843,0.005541246850043535,0.00023937146761454642,0.0001596319052623585
7528888745299283222,pure io l'ho fatto ma il povero ragazzo stava per compiere l'estremo gesto,0.008210896514356136,0.0006096273427829146,0.007394210901111364,0.0006213798187673092,0.0062551540322601795,0.001309367478825152,0.0008506775484420359
7528888745299283222,non ho capito,0.0008432447211816907,0.0032205150928348303,0.027159729972481728,0.004213878884911537,0.021958522498607635,0.0015048698987811804,0.0006820695125497878
7528888745299283222,@frabevacqua_ cosa fa dexter💔,0.004951130598783493,2.987818152178079e-05,0.0007060021162033081,0.00011244299093959853,0.003918882925063372,6.624876550631598e-05,5.55084552615881e-05
7528408301990694166,Andrea Lombardo merita di meglio,0.03602549433708191,0.0005718877073377371,0.01324678398668766,0.0024949507787823677,0.021092455834150314,0.0016780762234702706,0.0011095089139416814
7528408301990694166,con Andrea lombardo,0.0018984382040798664,0.0036118081770837307,0.03244560584425926,0.005353501532226801,0.027751479297876358,0.00185629993211478,0.000882327149156481
7528408301990694166,raga ma è Thomas,0.0018361894180998206,0.0003092554397881031,0.005368344951421022,0.0004604035639204085,0.00610241899266839,0.00021101278252899647,0.00014156379620544612
7528408301990694166,ora ho capito perché dicono che mura e Nicole si sono lasciati,0.0022635930217802525,0.001117624924518168,0.01768198423087597,0.0018397070234641433,0.011158146895468235,0.0006577175809070468,0.0005306501407176256
7528408301990694166,Raga ma non è possibile che è fidanzata? c'è bho,0.02445068396627903,0.001307180617004633,0.01589694619178772,0.0040355259552598,0.022350233048200607,0.0010062198853120208,0.00416435906663537
7528408301990694166,il moro è mura,0.33551475405693054,0.0005299311014823616,0.009640456177294254,0.006568594835698605,0.22082962095737457,0.005081119015812874,0.0015288928989320993
7528408301990694166,È infatti è tutto sbagliato come si è fidanzata?,0.0056022582575678825,0.00012457315460778773,0.0021289039868861437,0.00028777256375178695,0.0020617798436433077,0.00030895660165697336,0.002045762026682496
7528408301990694166,povero ragazzo..,0.00951775535941124,4.5290023990673944e-05,0.0006335832877084613,0.0002036245132330805,0.006198735907673836,7.273431401699781e-05,0.0001235126401297748
7528111917056019734,raga andiamo tutti sull ultimo video di Marta daddato a mettere emoji strane,0.0057988413609564304,0.0007385369390249252,0.01254994235932827,0.0019783361349254847,0.007794193923473358,0.0004059344937559217,0.0005747168906964362
7528111917056019734,E ti lamenti pure? Ti hanno lasciato il doppio di ciò che hanno trovato!,0.018676670268177986,5.330780186341144e-05,0.002137484960258007,0.00012228450214024633,0.00784857477992773,0.00022553782036993653,0.00030300923390313983
7528111917056019734,io una volta ho lasciato dei gelati🙈,0.0020148023031651974,0.00021543999901041389,0.003506871173158288,0.00035158119862899184,0.0014540281845256686,0.0002486526791471988,0.0003369420301169157
7528111917056019734,"Ci hanno fatto trovare nel frigo 2 acqua, 1 naturale e una frizzante, una Coca-Cola e una redbull, io allora dentro al frigo l’ultimo istante che ce ne stavamo andando ho lasciato 4 euro di mancia e un pacco di gelati cornetti",0.009976743720471859,0.00010713920346461236,0.00447737006470561,0.00015224366507027298,0.002407097490504384,0.00022955091844778508,0.0013035496231168509
7528111917056019734,"Io invece avrei un lungo elenco di host che non mi hanno fatto trovare nemmeno una bottiglietta. L’ultima però mi ha fatto trovare 3 buste di latte (sempre senza acqua), praticamente pronto a fare la ricotta.",0.0009082166943699121,0.00010500515782041475,0.0013444217620417476,0.00019599960069172084,0.0009528601658530533,0.00013777439016848803,0.00010370883683208376
7528111917056019734,Hai mica affittato a Gesù?? 😳,0.00588221987709403,0.00010085296526085585,0.0013084773672744632,0.0009266907582059503,0.0018933869432657957,0.00020966905867680907,0.00039156709681265056
7528111917056019734,Mi sono dimenticata un gelato in Francia,0.002394850365817547,0.00011387855920474976,0.0015843698056414723,0.0005816840566694736,0.0008555646636523306,0.00017298656166531146,0.00013830287207383662
7528111917056019734,"anche io lo faccio, ma ho sempre pensato fosse carino e un gesto antispreco",0.006253503262996674,0.004637512378394604,0.03725992515683174,0.005966880824416876,0.036444712430238724,0.0018452458316460252,0.0011425301199778914
7528111917056019734,quando ero più piccola con le mie amiche le bevevamo e poi le riempivamo con l acqua del rubinetto del bagno per non pagarle😂😂😂...adesso ovviamente non lo faccio più quindi non insultatemi😂,0.012159673497080803,0.00014961996930651367,0.0037630929145962,0.000374725233996287,0.003168172435835004,0.0005090822814963758,0.0017166653415188193
7529222658802584854,Facciamo una lista di tutti gli italiani con la residenza a Montecarlo???? Presenti e passati.,0.002246616641059518,0.00033190962858498096,0.0044447616674005985,0.0012249279534444213,0.0030270994175225496,0.00032355336588807404,0.00015667999105062336
7529222658802584854,Sinner ha guadagnato solo nel 2025 quasi 50 milioni di euro…se ne può comprare una decina di Ferrari…,0.0005664838245138526,3.903382457792759e-05,0.00038117088843137026,0.00010866310185519978,0.0003803732106462121,6.0613994719460607e-05,3.438512794673443e-05
7529222658802584854,"Sinner e un ragazzo del nord Italia ...voi del sud non lo.capirete mai..
che siamo Diversi",0.054106324911117554,0.00030914516537450254,0.004388607572764158,0.0016089541604742408,0.0042050862684845924,0.013819849118590355,0.000904299842659384
7529222658802584854,"SINNER È UN ALTO ATESINO UMILE E NON È UNO SBORRONE A CUI PIACE APPARIRE !!! LUI È UMILE E LO SI EVINCE DA QUESTO SUO GESTO CHE FA COME SE FOSSE UN SEMPLICE CONTADINO DEL MASO CHIUSO !!! SI INTENDE UN CONTADINO UMILE E DI BASSO PROFILO CON QUALCHE MILIONATA DI EURO SUL CONTO CORRENTE DELLA SPARKASSE !!! PERCHÉ QUESTO È IL VERO ALTO ATESINO DOC !!! CHE DIVENTA ROSSO QUANDO PARLA CON UNA DONNA E NON QUANDO BEVE IL VINO O LA GRAPPA !!! CHE AMA STARE UMILE E NASCOSTO!! SINNER È GIÀ BRAVO PERCHÉ HA VISSUTO A BORDIGHERA E PARLA PIÙ LINGUE !!!
OLTRE CHE LO SLANG LOCALE NA E JO !!! IO AMO L'ALTOADIGE CHE SE ULTIMAMENTE BOZEN E MERAN E BRUNECK SONO MULTICOLORE E SI SONO ADEGUATE AL PROGETTO SOSTENIBILE DI NONNO LELLO IL CAPO DEI CAPI CHE NON PUÒ VEDERE SINNER PER IL GRANDE PEL DI CAROTA FRATELLO DI PIPPI CALZELUNGHE NON È ANDATO A PALAZZO A ROMA A FARE IL SALAMECCHI!!! W IL SUDTIROL !! W LA VALLE AURINA !! PS. IO NON SONO TIROLESE , MA CONOSCO IL SUDTIROL E I TIROLESI MEGLIO DEI LOMBARDI !!",0.12038873136043549,0.0015666427789255977,0.010089777410030365,0.0021981564350426197,0.05226501077413559,0.0010137003846466541,0.007146570831537247
7529222658802584854,E’ una 812 Competizione,0.0008678234298713505,0.0013619199162349105,0.0124302227050066,0.0019492165884003043,0.010528141632676125,0.0008453038171865046,0.000442969030700624
7529222658802584854,va beh che problema c'è la pulirei pure io vuol dire che ci tiene alle cose che ha bravo !!!,0.03467562422156334,0.0006236816407181323,0.01793585531413555,0.0005856094066984951,0.008912264369428158,0.001659679226577282,0.0025456242728978395
7529222658802584854,ma il video chi lo fa😂? dirimpetto?,0.0019075513118878007,0.00019712091307155788,0.003423099173232913,0.000322476786095649,0.0019436641596257687,0.00037432622048072517,0.00030017446260899305
7529222658802584854,che c'è di strano tutti gli sportivi si prendono cura del loro mezzo.,0.02349896728992462,9.115540888160467e-05,0.0024661440402269363,0.0009081971365958452,0.011494873091578484,0.00013428997772280127,0.0002892581978812814
7529222658802584854,e se semplicemente gli piacesse farlo?,0.0018324187258258462,0.0015398074174299836,0.017332900315523148,0.0022347047924995422,0.011373096145689487,0.0012690048897638917,0.0006150658009573817
7529222658802584854,State tutti buoni !!!! Queste macchina sono vanità di vanità !!!! Fate del bene a chi non ha !!! Dopo la morte di Diogo e Andrea !!’ Prendo la metro!!!! La semplicità speravo avesse Sinner !!!🤦🏼‍♀️,0.0017051792237907648,6.548492820002139e-05,0.0008289814577437937,0.00011327877291478217,0.0004608595045283437,0.00021576191647909582,8.411715680267662e-05
7528191512228793622,TI HA REPOSTATO NIKY SAVAGE,0.7553046345710754,0.0077809663489460945,0.06203274056315422,0.013239138759672642,0.10079948604106903,0.002330195624381304,0.008000235073268414
