video_id,comment,toxicity,severe_toxicity,obscene,identity_attack,insult,threat,sexual_explicit
7532461851313966367,"hai fatto bene a sigillare , non si sa mai visto dove arriva la tua mente",0.036796435713768005,3.423559610382654e-05,0.0005071415798738599,0.00019390674424357712,0.02964363433420658,0.00011951546184718609,6.344421854009852e-05
7532461851313966367,Que buena idea,0.0007647936581633985,2.9739971068920568e-05,0.00036092379014007747,8.622927271062508e-05,0.0003645181132014841,4.854485086980276e-05,4.050914867548272e-05
7532461851313966367,Super Danke. Habe ich gleich gemacht. Jetzt läuft der Wasserzähler nicht mehr,0.0003507240326143801,0.0018824465805664659,0.01388859935104847,0.0022717867977917194,0.010208649560809135,0.0008792048320174217,0.000407760264351964
7532461851313966367,ne oldu da,0.11323957145214081,0.002183176577091217,0.057406701147556305,0.002715117298066616,0.018242018297314644,0.0016437529120594263,0.0011680545285344124
7532461851313966367,Anlamadim vallah🥺🥺🥺,0.007166309282183647,0.004182490054517984,0.030476856976747513,0.004516176413744688,0.019476838409900665,0.003012068336829543,0.0011076818918809295
7532139075919301910,daiana???? 🤔🤔🤔🤔,0.0017908323789015412,6.859338463982567e-05,0.001042722724378109,0.00017998629482463002,0.0009092881809920073,0.0001263208978343755,7.199792889878154e-05
7532139075919301910,uscite il nome della tipa,0.006187803577631712,0.0021530678495764732,0.02397223562002182,0.0021787756122648716,0.02193266898393631,0.002801257185637951,0.0006626800168305635
7532139075919301910,"non se l'aspettava nessuno, senza rivali 👏🤣🤣🤣",0.0023816809989511967,8.729039836907759e-05,0.001098757260479033,0.00022299859847407788,0.0009078878210857511,0.00037009469815529883,0.00019947638793382794
7532139075919301910,Il capo sicuramente autoritario e non sottone con le dipendenti. Noooooo....,0.025258446112275124,0.0001370473182760179,0.003112172707915306,0.0011256325524300337,0.01601128838956356,0.0001573474146425724,0.0009626573300920427
7532139075919301910,"esattamente così, bravissima, il tuo capo sta in buone mani",0.012944498099386692,0.00022975368483457714,0.005385660566389561,0.0005076334346085787,0.004559289664030075,0.0007747277850285172,0.003024473087862134
7532139075919301910,"Capo questa ragazza è riuscita benissimo nella promozione del suo locale, ci tenevo ad informarvi che vorrei un rimborso in qualche modo perché ho sputato un polmone dalle risate 😂 una promozione subito a lei 😂😂😂",0.006720397621393204,0.0001053995147231035,0.001525425468571484,0.0003573730937205255,0.002401376608759165,0.0003757182275876403,0.0006701004458591342
7532139075919301910,come minimo ad agosto un bonus alla ragazza,0.000672187830787152,5.1581628213170916e-05,0.000402914040023461,0.00016624710406176746,0.00041708670323714614,9.097573638428003e-05,0.00017746826051734388
7532139075919301910,l'ho guardato già 20 volte e non smetto lo giuro 😂😂,0.0037466378416866064,0.00043351409840397537,0.007847434841096401,0.0007411890546791255,0.0030509214848279953,0.0006415732204914093,0.0004155575588811189
7532139075919301910,😂😂😂 arrivo,0.0006037295097485185,2.0013696484966204e-05,0.00014498150267172605,0.00013241797569207847,0.000254282436799258,3.9822083635954186e-05,1.9796179913100787e-05
7532139075919301910,funzionaaaa❤️🤣,0.0007255492964759469,4.231083585182205e-05,0.00044210025225766003,0.0001155794961960055,0.00038891570875421166,5.480809340951964e-05,3.6162724427413195e-05
7532975249344826646,e quindi? perché saresti sempre stanca?,0.019083764404058456,0.0004809785168617964,0.008180501870810986,0.0011529735056683421,0.016647810116410255,0.0006964887725189328,0.00024196208687499166
7532975249344826646,Sono dati sensibili,0.0005581497680395842,0.002921928185969591,0.022184010595083237,0.003976420499384403,0.015411739237606525,0.0013459136243909597,0.0007032174617052078
7532975249344826646,Mamma mia Guardate l'espressione di quella faccia 🤦🤦,0.250986784696579,0.002217230387032032,0.04807448759675026,0.00251392787322402,0.03645544871687889,0.0021895815152674913,0.007318395189940929
7532975249344826646,qualcuno è interessato alle sue analisi?😂,0.001065622316673398,9.7035059297923e-05,0.0015079560689628124,0.00021940501756034791,0.0013023093342781067,0.00010178268712479621,7.976910274010152e-05
7532975249344826646,alla fine sei incinta.?,0.1341356784105301,9.227416012436152e-05,0.0031632143072783947,0.00034982641227543354,0.06878896802663803,0.0007117334171198308,0.0014515711227431893
7532975249344826646,ha un eleganza questa donna 😂😂,0.04508189484477043,0.00017536741506773978,0.002214716747403145,0.005398856941610575,0.017717832699418068,0.00026631151558831334,0.001101345638744533
7532975249344826646,ma sei seria?,0.01038060151040554,0.0005168008501641452,0.01092678401619196,0.0008945887675508857,0.01261583436280489,0.0004557673237286508,0.00033849600004032254
7532975249344826646,Quindi cos’hai??,0.0012942570028826594,9.659735951572657e-05,0.0016691507771611214,0.00020168301125522703,0.0011348947882652283,0.00012015274842269719,9.168622636934742e-05
7532975249344826646,siamo alla frutta,0.005377704743295908,0.00012773554772138596,0.0024547053035348654,0.00018575633293949068,0.0027230901177972555,0.0004798309237230569,0.0004788351070601493
7532975249344826646,Crepi,0.2214350551366806,0.0004023586225230247,0.01023926679044962,0.0005499732797034085,0.17767475545406342,0.01061281282454729,0.003710507182404399
7532266544747924758,ma che ha detto 🥰 non lo capisco 😂,0.0015638497425243258,0.00038560162647627294,0.005948141682893038,0.0007324352627620101,0.004295841790735722,0.00025327489129267633,0.00016810222587082535
7532266544747924758,"meno male che la mamma lo invita a parlare italiano ,se fosse per il padre....",0.003710792865604162,2.9994089345564134e-05,0.0003333664790261537,0.00025253897183574736,0.0009442415903322399,0.00021333721815608442,0.00015424728917423636
7532266544747924758,"Ecco perché napoli hanno difficoltà a parlare in italiano, già da piccolissimi parlano in dialetto.",0.017246849834918976,7.471928984159604e-05,0.0023817443288862705,0.0006109541282057762,0.010287528857588768,0.00011345637904014438,0.00015448853082489222
7532266544747924758,Grazie mille a tutti sasi è un bambino molto vivace e spiritoso ama divertirsi e far divertire grazie mille a tutti voi ❤️❤️❤️,0.033272191882133484,0.0006470426451414824,0.017162032425403595,0.0007828305824659765,0.02520005777478218,0.00028822204330936074,0.0008943816064856946
7532266544747924758,Ahahahqhqhqhqhhwhqhqhqhw,0.001889457693323493,0.0009937434224411845,0.010452250018715858,0.0016869049286469817,0.006283625494688749,0.0005660968599840999,0.0004048809933010489
7532266544747924758,HAHAHAHAHAHAHAHAHAHAHA,0.0025650737807154655,0.00012141620391048491,0.0014102294808253646,0.00043069542152807117,0.0009391690837219357,7.846017979318276e-05,0.00010337195271858945
7532266544747924758,tesoro mio tuo figlio che ti dice che devi fare nu poc e diet😂😂😂😂😂😂😂😂😂 siete il top.. se vi capita di andare in vacanza in puglia veniteci a trovare la zia Giò vi aspetta allo street food il capriccio di felice Conte e la zia Giò tutto il mese di agosto siamo in giro x il Molise vi aspettiamo @AGS e @Elettronica 51 vi aspettiamo x farvi assaggiare i nostri mitici torcinelli alla brace nu VAS azzcus dalla zia Giò 😘,0.01857113093137741,0.0001338803267572075,0.006212189327925444,0.0002911329211201519,0.007251091301441193,0.00026987664750777185,0.0015371660701930523
7532266544747924758,Hahahah io lo amo 😂😂😂🥰❤️,0.0003603197983466089,4.442085264599882e-05,0.00037080171750858426,0.00013406990910880268,0.0002641756145749241,5.234333366388455e-05,3.359884431120008e-05
7532266544747924758,cosa succede l 1 agosto,0.0016534082824364305,0.004243671894073486,0.040173277258872986,0.00571544049307704,0.02510247565805912,0.0020049738232046366,0.001083478331565857
7532266544747924758,Ti giuro mi ha fatto piegare in due dalle risate… Sij fort Sasy continua così t voglj ben ❤️❤️❤️,0.008145369589328766,0.00012742739636451006,0.003681316738948226,0.00021477323025465012,0.002218238078057766,0.0005911720218136907,0.0008310512639582157
7532612623662091542,io stavo guardando il tipo in alto depresso che non sa che ci fa li😂😂😂😂😂😂😂,0.004686168394982815,9.767097071744502e-05,0.0015545232454314828,0.0002701260964386165,0.002057805424556136,0.00021871263743378222,0.0002358251076657325
7532612623662091542,@Anastasia Scerba sei diventata chanel totti e addirittura ti abbracci fedez??,0.038588494062423706,9.163273352896795e-05,0.003912644926458597,0.0005043100100010633,0.027596762403845787,0.0002949174668174237,0.000434872112236917
7532612623662091542,ma chi è il dj????,0.0016738533740863204,0.00015741074457764626,0.0034070636611431837,0.00026246419292874634,0.002423697616904974,0.00014828078565187752,0.0001423396752215922
7532612623662091542,"Non è lei ma questo non è un problema, ""A Sardegna"" mi sembra più grave.😅",0.001163122127763927,4.427089152159169e-05,0.0006171271670609713,0.0001300178118981421,0.0005141216097399592,0.00012614818115253001,6.623714580200613e-05
7532612623662091542,pensa che brividi.... hai incontrato Einstein e Margherita hack,0.1475214809179306,0.00022652225743513554,0.011084442026913166,0.0007379705202765763,0.07923564314842224,0.0010268252808600664,0.0009178261971101165
7532612623662091542,"Non è chanel, è un altra di facili costumi",0.023965666070580482,0.00010407300578663126,0.003847109852358699,0.0009192694560624659,0.01979445107281208,0.00014864729018881917,0.00027271019644103944
7532612623662091542,Grande fedez continua a montare carnevali commerciali pieni di minorenni 🤣🤣🤣🤣 6 a.m. Addirittura After,0.002427083905786276,4.391344918985851e-05,0.000608748581726104,0.00014070198812987655,0.0008116137469187379,0.0001459809864172712,0.0001443978981114924
7532612623662091542,Troppo traffico 😂😂😂 Passo il prossimo anno 😂 per la Sardegna 😁,0.0005982831935398281,2.774087988655083e-05,0.0002717433962970972,0.00012833732762373984,0.00035573472268879414,3.935166751034558e-05,2.863211921066977e-05
7532612623662091542,Fedez tutto serio li sopra ma ca fatto,0.31605347990989685,0.0019888633396476507,0.11658668518066406,0.002492260653525591,0.021154003217816353,0.0018517995486035943,0.004569947253912687
7532612623662091542,Stiamo parlando del nulla....,0.0026199526619166136,0.00010995894990628585,0.0023069463204592466,0.00023840846552047879,0.0018687181873247027,0.0001629350008442998,0.00013298790145199746
7531451432361397512,Tegwolo 🥹,0.003894404275342822,0.005277562420815229,0.03912944346666336,0.00847987737506628,0.03086625225841999,0.0022206983994692564,0.0011129413032904267
7531451432361397512,Who remember Tegwolo 🤧😂😭,0.0006068114889785647,4.6268327423604205e-05,0.00043637616909109056,0.00017075796495191753,0.00040870162774808705,5.394077379605733e-05,3.2565458241151646e-05
7531451432361397512,Tegwolo is that you 😳😂,0.006091964431107044,2.7037440304411575e-05,0.00029912713216617703,0.0004212410713080317,0.0015117158181965351,4.32073138654232e-05,2.9280470698722638e-05
7531451432361397512,Tegolo s’est toi ?,0.01202824804931879,0.00017647806089371443,0.00405955919995904,0.0004963320097886026,0.006980606354773045,0.00027289046556688845,0.0005116823012940586
7531451432361397512,[sticker],0.0003277757787145674,3.6870034819003195e-05,0.00020574730297084898,0.00014401548833120614,0.00029761038604192436,4.7747991629876196e-05,2.5132996597676538e-05
7531451432361397512,If you didn’t find this funny. God bless you🙌🏼🥺,0.0008857896900735795,2.248506643809378e-05,0.00016129891446325928,0.00013201516412664205,0.00027012944337911904,4.365386485005729e-05,2.354161551920697e-05
7531451432361397512,"Why didn’t the school take his personal measurement?
That’s not fair",0.0008191292872652411,1.8859998817788437e-05,0.0001844699727371335,8.4596591477748e-05,0.00034762657014653087,3.309499879833311e-05,2.6732648620964028e-05
7531451432361397512,That’s not nice. He’s a child,0.04395731911063194,3.42370658472646e-05,0.00068710558116436,0.00011305279622320086,0.028175853192806244,8.303598588099703e-05,0.00014723031199537218
7531451432361397512,Tegwolo champion of Warri,0.0008794260211288929,0.00010536664922256023,0.0010316893458366394,0.00025041107437573373,0.0017744918586686254,7.34086861484684e-05,5.61841661692597e-05
7531451432361397512,"Every body is going to run away from this question, do you love God 🥺??",0.01786568947136402,0.00011091705528087914,0.002825978212058544,0.000851541175507009,0.0013328595086932182,0.0003632432490121573,0.0008788094855844975
7532468636431322370,ah regà è bello magnà.,0.007300226949155331,0.0003446277405600995,0.0060883620753884315,0.0007895247545093298,0.006176278926432133,0.00034455148852430284,0.00028028953238390386
7532468636431322370,Devo dimagrire,0.010758918710052967,0.0001603960117790848,0.0009824238950386643,0.00032684713369235396,0.00508416211232543,0.002357183489948511,0.0001385228824801743
7532468636431322370,oggi non dovevo mangiare...,0.0013340037548914552,0.0002888007729779929,0.0035105424467474222,0.0005472306511364877,0.0021103443577885628,0.0003436050028540194,0.00013011318515054882
7532468636431322370,"no così è troppo,stai bene?",0.004090840928256512,0.0014768358087167144,0.019621467217803,0.0025076651945710182,0.014723749831318855,0.0008181666489690542,0.0004761281597893685
7532468636431322370,"se volete dimagrire dovete diminuire le quantità di poco e poco alla volta, mangiare più salutare, evitare bevande gassate o con troppi zuccheri e preferite cibi fatti in casa (quindi meno merendine). Se smettete di mangiare non fate altro che danneggiare il vostro corpo e se prima dimagrirete dopo ne subirete le conseguenze che non sono poche e non sono belle. Vi prego non fate niente, seguite le dritte che vi ho dato all’inizio piuttosto o affidatevi a un nutrizionista, cosa che non sono. Parlatene con qualcuno, andate dallo psicologo, ma mangiate. E no, il cibo non si merita, il nostro corpo ha BISOGNO del cibo ma non bisogna abusarne perché si potrebbe arrivare a stare male, bilanciatelo e allontanare le persone che vi fanno sentire sbagliati, perché loro un discorso di questo non lo farebbero. Siete forti❤️‍🩹",0.0024501150473952293,0.00015166786033660173,0.0034514761064201593,0.0001511292502982542,0.0011969084152951837,0.000145616868394427,0.00032537037623114884
7532468636431322370,magari devo stra dimagrire ma non ce la faccio,0.019731178879737854,0.0018887689802795649,0.020367087796330452,0.001626578508876264,0.015544509515166283,0.004321756772696972,0.002363721141591668
7532468636431322370,a me sembrano di quando eri più piccola gli ultimi 3,0.0202895849943161,6.602361827390268e-05,0.0026079039089381695,0.00023661970044486225,0.013820583932101727,0.00010933788144029677,0.00041218585101887584
7532468636431322370,non riesco…,0.0006950009264983237,6.959374150028452e-05,0.0007763485191389918,0.0001692280056886375,0.000692588509991765,0.00010328140342608094,5.642120595439337e-05
7532468636431322370,almeno te sei dimagrita.,0.2860374450683594,0.00013216694060247391,0.0030478350818157196,0.0005729396361857653,0.18886883556842804,0.0008571240468882024,0.0007231888012029231
7532468636431322370,ho perso solo una taglia😭 ne voglio perdere ancora,0.09514938294887543,0.0019540314096957445,0.03023633360862732,0.0029197437688708305,0.011843155138194561,0.001564490026794374,0.0018473846139386296
7532307132616592662,"se la porti in giro per casa con le luci accese non dormirà mai ... magari provate a lasciarla nel lettino, luce soffusa, la cullate da li. Mia figlia a 2 mesi iniziò a stare sveglia dalle 23 alle 6...ne so qualcosa, ma mai allontanata dalla camera da letto",0.030667619779706,0.00018005151650868356,0.0021550930105149746,0.00040925995563156903,0.001229599118232727,0.01666826754808426,0.001494765398092568
7532307132616592662,[photo],0.00017441672389395535,0.0001562670076964423,0.0010168143780902028,0.0002656339493114501,0.00062783487373963,0.00012700899969786406,7.331193774007261e-05
7532307132616592662,Ti posso consigliare “Michienzi Studio”. Lo seguo da un po’e ci ha svoltati la vita 🥰❤️comunque è bellissima complimenti❤️(in vari video spiega anche come farli addormentare con più facilità),0.0005660237511619925,4.161721153650433e-05,0.0005869860760867596,8.628289651824161e-05,0.0004252567596267909,4.019100742880255e-05,5.4302363423630595e-05
7532307132616592662,A me manca da morire.Starei con lei in braccio tutto il giorno [photo],0.0769692212343216,0.0009170840494334698,0.006906643509864807,0.0005103371804580092,0.0020306557416915894,0.039082322269678116,0.0020871260203421116
7532307132616592662,io ho cresciuta mia nipote fino a 6 anni e ora sto crescendo l'altro 2 anni🥰🥰🥰 ne so tante cose,0.0017221653833985329,0.0050830477848649025,0.03322959691286087,0.0055227503180503845,0.02509440667927265,0.0014613325474783778,0.002181501593440771
7532307132616592662,Solo il mio dai 2 mesi e mezzo ha iniziato a dormire da solo fino alle 10-11 di mattina?,0.0007595395436510444,7.510182331316173e-05,0.0009125403012149036,0.00013270768977236003,0.0004013518919236958,0.00011224823538213968,0.00013101592776365578
7532307132616592662,occhio che percepiscono che ti scocci e non si addormentano manco per le 5😂❤️,0.02494649402797222,0.00011746636300813407,0.003982648253440857,0.0002302121720276773,0.008649541065096855,0.00173546327278018,0.00104134576395154
7532307132616592662,secondo me nn nessuna intenzione di dormire 😂,0.00042360418592579663,3.1674942874815315e-05,0.0002674833231139928,0.00011284460197202861,0.0002513969084247947,3.6199915484758094e-05,2.9442875529639423e-05
7532307132616592662,"il nostro a un certo orario nel letto con luci soffuse,silenzio in casa ha sempre dormito ora ha 9 mesi ,abbiamo mantenuto questa abitudine dorme tutta notte fino le 8 30 del mattino",0.0006269800942391157,4.0806418837746605e-05,0.000474482832942158,8.125932072289288e-05,0.0002377066557528451,6.517990550491959e-05,9.897532436298206e-05
7532307132616592662,Fai un giro con l'auto 🚗 e vedrai come dorme.👌😂😂😂,0.0019206154393032193,5.0013586587738246e-05,0.00034685523132793605,0.00016746867913752794,0.0006684506079182029,0.0003314659697934985,6.433217640733346e-05
7531758012357152022,dont all countries in eu have it?,0.0005183607572689652,3.55597076122649e-05,0.00024703776580281556,0.00016962525842245668,0.00024178197782021016,4.457081013242714e-05,3.133030259050429e-05
7531758012357152022,Every EU country has these 🤣🤣👍🏻,0.00042912786011584103,2.1698970158468e-05,0.00014228606596589088,9.759565000422299e-05,0.00017927582666743547,3.262084646848962e-05,2.2211608666111715e-05
7531758012357152022,Exactly!!!! Caprice are delicious 💙 Welcome to our country!!🇬🇷🇬🇷🇬🇷💦💦,0.008000534027814865,3.962744085583836e-05,0.0005659425514750183,0.0004081787192262709,0.0038268715143203735,5.6507687986595556e-05,3.3326956327073276e-05
7531758012357152022,They have a really bad taste 😭,0.04036135599017143,5.623187098535709e-05,0.0013912261929363012,0.0010277158580720425,0.010943705216050148,0.0003438122512307018,0.00020273202972020954
7531758012357152022,Save the flight get them in home Bargins!,0.01129493024200201,6.331680924631655e-05,0.00023287924705073237,0.000450698658823967,0.00077438895823434,0.0044331420212984085,0.00011761375208152458
7531758012357152022,I knew it would be caprice!! They're the BEST you can sometimes find them in home bargains too...,0.001491054310463369,1.4720186300110072e-05,0.0001871285494416952,9.051607048604637e-05,0.0004632622003555298,3.2700394513085485e-05,3.497682337183505e-05
7531758012357152022,Are these vegetarian ?,0.0037080859765410423,2.445537393214181e-05,0.00014477054355666041,0.0009823784930631518,0.0009608338004909456,6.877697160234675e-05,3.663618554128334e-05
7531758012357152022,no lays crisps for me! oregano flavour! bliss!!!,0.008589642122387886,9.105679782805964e-05,0.001761223073117435,0.00030034163501113653,0.0021275996696203947,0.000996308634057641,0.0004590426688082516
7531758012357152022,i have it in finland🇦🇽🔥,0.0005370244616642594,5.280075492919423e-05,0.00036880772677250206,0.0001948255958268419,0.000183820680831559,5.003458136343397e-05,3.949038728023879e-05
7531758012357152022,thats the exact supermarket i Went to,0.0016507523832842708,9.22198814805597e-05,0.0011155944084748626,0.0003235678595956415,0.0009217133047059178,0.00010143715917365626,7.197156810434535e-05
7533116302798376214,Da 5 anni ho il lupus eritematoso sistemico 🙏🏼💪🏼❤️,0.0025726391468197107,6.300030509009957e-05,0.0006674175383523107,9.215579484589398e-05,0.0010313738603144884,0.00024377751105930656,0.00029809967963956296
7533116302798376214,io ho la sclerosi multipla,0.009198733605444431,0.000874048622790724,0.00972838420420885,0.001914224005304277,0.00935711432248354,0.0009364791330881417,0.0009702579118311405
7533116302798376214,Adesso sono curiosa.. visto che soffro d’ansia! Che malattia è? 😅,0.0012138659367337823,7.151701720431447e-05,0.00041075240005739033,0.0002379139041295275,0.00044024729868397117,0.00013127666898071766,5.73255711060483e-05
7533116302798376214,mio figlio morbo di crohn scoperto tre mesi fa' 😢🤞🙏💪🍀,0.005980576388537884,5.988181510474533e-05,0.0011686549987643957,0.00011783400259446353,0.004017167259007692,0.00012364097347017378,0.00017303324420936406
7533116302798376214,Io ho il lupus però per fortuna trovato cura giusta medico giusto,0.0038005386013537645,0.00017808645498007536,0.00260842009447515,0.0002476155059412122,0.002192263724282384,0.0004941326915286481,0.00045345252146944404
7533116302798376214,"anche a me è successa la stessa cosa mi recavo spesso dal medico xchè avevo un malessere generale il medico mi disse sei fissata , ho la fibromialgia 😡",0.005264069885015488,0.0015699906507506967,0.01029750145971775,0.0007638526149094105,0.007137448061257601,0.0013818232109770179,0.001489040907472372
7533116302798376214,mia figlia emicrania con aura e non capivano anche in ospedale niente dicevano ansia .,0.003265140810981393,0.00031336600659415126,0.0029318025335669518,0.0004466764803510159,0.001537201227620244,0.0007444513030350208,0.0009768811287358403
7533116302798376214,"lupus, scoperto finendo in terapia intensiva♥️",0.016054745763540268,0.0006547255907207727,0.008686034940183163,0.0006242001545615494,0.010876171290874481,0.002880343934521079,0.0013963524252176285
7533116302798376214,"Io labirintite virale, malattia molto rara nei giovani",0.006474973633885384,0.00016279118426609784,0.0010920901549980044,0.00034997050534002483,0.0019091108115389943,0.0006501695606857538,0.00040442965109832585
7533116302798376214,"I un anno e mezzo che non mi sentivo bene !!
Uno dei tanti specialisti scienziati luminari che mi visitò mi disse testuali parole : ""si vada a fare una bella scampagnata ed una doccia calda"", un'altro ancora mi disse : ""è lo stress e un po' d'ansia, lei deve stare tranquillo"" (tra l'altro non ero nè stresstao ne in generale soni tipo ansioso semplicemente tenevo i Maronna dei dolori nel corpo!!!...)..bene ,poi all'improvviso ricoverato di urgenza per quasi un mese in ospedale : morbo di crohn ed artrite psoriasica... !!!
Ah quasi me ne dimenticavo : quando dissi al mio medico di base che avevo sempre diarrea lui mi disse ""è l'ansia ""
Oggi sono in cura con terapia biologico ogni 28 giorni!!
#maallanemaechivemmuort a vuje e l'ansia !!!!",0.0016058572800830007,0.00011430459562689066,0.0004998653894290328,0.00015806742885615677,0.0009673406602814794,0.0001881000935100019,0.00018489084322936833
7532178176773016854,e pensare che viola ha un altro🤨,0.01330614648759365,0.003378133988007903,0.041677724570035934,0.002893653232604265,0.023722359910607338,0.0014635378029197454,0.006646198220551014
7532178176773016854,e con chi lo dovrei fare scusa 🤦🏼‍♀️💕,0.005320659838616848,0.0020118877291679382,0.018889330327510834,0.004696635529398918,0.01169529091566801,0.0021996325813233852,0.000473136460641399
7532178176773016854,Chi da insta,0.0014437221689149737,0.0001263875310542062,0.0020746071822941303,0.00023503383272327483,0.001969981240108609,0.0002055572986137122,0.00011565502791199833
7532178176773016854,Pov:sono Cristiano Borsi e Viola Silvi [photo],0.0007979186484590173,0.0025088845286518335,0.023327922448515892,0.004054029937833548,0.017413856461644173,0.0008395846816711128,0.0006889440701343119
7532178176773016854,Ciao o sfortuna,0.012664740905165672,0.0011192273814231157,0.016260901466012,0.0015346929430961609,0.020752225071191788,0.001982007408514619,0.0009710712474770844
7532178176773016854,Cosa succede il 1 agosto,0.0013332429807633162,0.0019295720849186182,0.01993727870285511,0.0025593950413167477,0.011334152892231941,0.0011076427763327956,0.0005484917783178389
7532178176773016854,"TI PREGO CRI FAI UNA 24 ORE DOVE FAI IL ROMANTICONE CON VIOLA, VOGLIAMO VEDERE LA SUA REAZIONE💕
SE VOLETE IL VIDEO TAGGATE CRI💕
@Cristiano🌓",0.6936580538749695,0.004395955707877874,0.04825388267636299,0.012389279901981354,0.03049173206090927,0.002844482194632292,0.035868704319000244
7532178176773016854,sopra un video di fabio,0.005549437832087278,0.0013853968121111393,0.014954810030758381,0.0019122152589261532,0.01138882152736187,0.002275138860568404,0.0008886884897947311
7532178176773016854,cristiano ri ricorda qualcosa?💕@Viola Silvi [photo],0.0028188680298626423,0.000197831162950024,0.0006736881914548576,0.0023647770285606384,0.0008152782102115452,0.0003040144802071154,0.00029926435672678053
