video_id,comment,toxicity,severe_toxicity,obscene,identity_attack,insult,threat,sexual_explicit
7532365326902676768,non ho capito quale sarebbe la parte che fa ridere,0.0037624638061970472,0.0007408055826090276,0.012810011394321918,0.0017888867296278477,0.008785285986959934,0.0004661452258005738,0.0003584069199860096
7532365326902676768,"""Lucaa...che c'è?? noo volevo essere sicuro che ti chiami ancora accussì""🤣🤣Scusate ma a me il padre fa proprio ridere.🤣🤣",0.025732828304171562,0.00012321550457272679,0.006249270401895046,0.000296972953947261,0.006706724409013987,0.00024065986508503556,0.0011010749731212854
7532365326902676768,possiamo solo sperare di avere presto Vannacci al governo per sistemare un po' le cose,0.0007856210577301681,5.686212534783408e-05,0.0005448454176075757,0.00012287817662581801,0.0007665359880775213,0.00010381529136793688,5.1505536248441786e-05
7532365326902676768,purtroppo è la realtà,0.0012873999075964093,0.0005189268267713487,0.006107707973569632,0.001062571071088314,0.005473503842949867,0.00036792471655644476,0.00019125598191749305
7532365326902676768,"infatti,viviamo in un mondo al contrario",0.001026471727527678,0.00022784052998758852,0.0033555063419044018,0.0005098359542898834,0.002514968393370509,0.00018886226462200284,0.0001257940602954477
7532365326902676768,"c'è un ragazzo che conosco che prima era una ragazza, ora si chiama Ivan, Ivan è la persona più buona del mondo, darebbe la vita per veder sorridere chi vuole bene, ma per voi Ivan non sarà normale perché guardarete solo al fatto che prima si chiamava con un nome femminile, la verità è che ivan non è normale perché gli piace più il sushi che la pizza, non è normale perché con 3 birre si ubriaca, ma non perché è disforico",0.0094562117010355,4.6076089347479865e-05,0.0005611756350845098,0.0004492244333960116,0.004300878383219242,6.393855437636375e-05,0.00038925508852116764
7532365326902676768,"Ha usato ironia e si scherza, nessuno vuole offendere sicuramente, ma vi rendete conto che è la realtà dei giorni nostri ?! Mario / Lucia poi Antonella poi ritorna Mario, io non ci vedo niente di naturale, vedo solo gente che con questa libertà di genere hanno perso la loro identità reale, mi pare tanto anche questa una moda … come un filler …",0.00459660729393363,3.907486461685039e-05,0.001256492338143289,0.00013950871652923524,0.0023941739927977324,4.802220792043954e-05,0.00013451605627778918
7532365326902676768,che attore bernardino❤️,0.024157389998435974,0.0003176038444507867,0.008186748251318932,0.00044241559226065874,0.010935569182038307,0.0007909577689133584,0.0005365828983485699
7532365326902676768,Voi scherzate ma tra un po’ sarà così,0.01854803040623665,0.00016377797874156386,0.0057548037730157375,0.00027245006640441716,0.008756130002439022,0.00042873944039456546,0.0018104711780324578
7532365326902676768,capisco la gag simpatica! ma l'argomento è estremamente serio cè tanta sofferenza dietro,0.09517991542816162,0.00015657066251151264,0.005225935485213995,0.0004351076204329729,0.06346885859966278,0.00045785028487443924,0.000758037727791816
7530031966960340257,um quê 🙄?,0.0007333523244597018,4.827598240808584e-05,0.0005053766071796417,0.00014035144704394042,0.0005407035350799561,6.0729653341695666e-05,3.5301403841003776e-05
7530031966960340257,Da-me um Grrr - Feat McDonalds,0.144245445728302,0.0011355024762451649,0.04343641549348831,0.000625156273599714,0.011571427807211876,0.010617000050842762,0.014716246165335178
7530031966960340257,Finally a Drive employee understands his joke 😂😂😂,0.002428012201562524,1.237634387507569e-05,0.00014858621580060571,0.00010212694178335369,0.0011974734952673316,2.3047310605761595e-05,1.960094232345e-05
7530031966960340257,Ela participando da brincadeira,0.049010638147592545,0.00016503900405950844,0.006208366248756647,0.00032266558264382184,0.030194982886314392,0.0009873779490590096,0.0020225699990987778
7530031966960340257,Employee passes the vibe check ✅,0.0006550224497914314,2.5337360057164915e-05,0.0001495800242992118,8.336977771250531e-05,0.00025926329544745386,7.96145322965458e-05,4.0355767850996926e-05
7530031966960340257,"No, This is acually real. This is portuguese. He asked her give me a grrrr and she asks what because she doesn't know what it is 😂🤣🤣",0.022965341806411743,0.00015927689673844725,0.009167504496872425,0.0008622404420748353,0.003997569903731346,0.0001171487892861478,0.0003888084029313177
7530031966960340257,Teve uma vez que fui no Mc e o atendente falou “ eu não ouvi direito” e eu disse “ estamos capitão”,0.0014025958953425288,5.0224840379087254e-05,0.001128469593822956,0.00010155572817893699,0.0011121740099042654,5.516450255527161e-05,0.00013662913988810033
7530031966960340257,CADÊ O COMENTÁRIO DA ISABELLY LIMA,0.028062092140316963,0.0017199419671669602,0.025245098397135735,0.003482507076114416,0.022737817838788033,0.0015020667342469096,0.0008806343539617956
7530031966960340257,Ahahah grrrrr,0.0006213948945514858,2.3340580810327083e-05,0.0002737423055805266,8.043809066293761e-05,0.000407964747864753,3.934727646992542e-05,3.371400453033857e-05
7531296529957588246,E la pelle “spellata”? Parliamone,0.17758336663246155,0.0001874119188869372,0.003611666150391102,0.00028389066574163735,0.11201208084821701,0.00383774284273386,0.004941172897815704
7531296529957588246,le unghie e pure la pelle 'spelacchiata' del sole che si toglie 💀✨,0.0109499990940094,9.499983571004122e-05,0.003191172145307064,0.0001323736651102081,0.004030031152069569,0.0003481731400825083,0.0007662876741960645
7531296529957588246,"Se ci fate caso, nel video di presentazione lei non aveva alcuna applicazione, ma le sue unghie molto corte e naturali. Evidentemente la produzione pretende, per motivi estetici, che abbiano tutte le unghie a posto (solitamente o bianco latte o rosse). Sonia sarà andata dalla prima onicotecnica che le è capitata a tiro e le ha fatto un pessimo lavoro.",0.01105621550232172,0.00024019267584662884,0.004086649045348167,0.00083734723739326,0.003090811427682638,0.00034325270098634064,0.0021780086681246758
7531296529957588246,"Sicuramente è una ricostruzione su onicofagica, ma fatta male…",0.009031492285430431,0.0003928124497178942,0.003906628582626581,0.00046409311471506953,0.004820512607693672,0.0010431738337501884,0.002583876485005021
7531296529957588246,"Ragazze l’estetica nella vita non è tutto sappiatelo, non a tutte interessa apparire 🤷🏻‍♀️",0.0011754839215427637,3.306301005068235e-05,0.0003415264654904604,0.0001479636994190514,0.0006675793556496501,3.63047729479149e-05,0.00010282709990860894
7531296529957588246,onicodagica grave ..già tanto che sono tutte ancora attaccate,0.18910418450832367,0.0005798578495159745,0.004355821758508682,0.0014573149383068085,0.06665801256895065,0.021930838003754616,0.006588054820895195
7531296529957588246,sembrano denti 🦷,0.06151658296585083,0.00501492153853178,0.04304315522313118,0.008001434616744518,0.03533485159277916,0.0023741088807582855,0.007088829297572374
7531296529957588246,anche io non riuscivo a guardare le sue mani.,0.005989583674818277,0.0005509239854291081,0.006885942537337542,0.0010783137986436486,0.00688230711966753,0.0011233605910092592,0.0010579766239970922
7531296529957588246,allora non sono l unica a notare queste cose,0.003075537970289588,0.0026898446958512068,0.026602081954479218,0.005204775836318731,0.01815393567085266,0.0012708838330581784,0.000502961513120681
7531296529957588246,Non ne troverai mai più una come me 😂😂😂😂 unica e inimitabile 😂😂😂😂,0.0016157451318576932,2.8344036763883196e-05,0.0005138546111993492,0.0001248295302502811,0.0007607786683365703,3.103604831267148e-05,4.173469642410055e-05
7531299148528635158,dad body sempre il migliore,0.007550592068582773,0.00013831196702085435,0.002863496309146285,0.0002503738214727491,0.004081930033862591,0.00036127548082731664,0.0007115957560017705
7531299148528635158,Sempre amato i chunky,0.004317720886319876,8.640030864626169e-05,0.0014075072249397635,0.0002748456026893109,0.0017657619901001453,0.0002672770933713764,0.0004498299094848335
7531299148528635158,Devo scorrere ma non dimentico,0.0006531422841362655,7.701475988142192e-05,0.0006965369102545083,0.0001664272858761251,0.0008085462031885982,0.00015244165842887014,6.311888864729553e-05
7531299148528635158,dad body🙏🏻,0.0006676585762761533,2.1702466256101616e-05,0.00014305934018921107,9.154068538919091e-05,0.0002976912655867636,4.5908807805972174e-05,2.73521218332462e-05
7531299148528635158,"It’s unreal how close I was to skipping Ego Destruction by Drenn Solace. This isn’t just a book, it’s a psychological trapdoor into the part of yourself you’ve been avoiding.",0.00731549970805645,3.6755063774762675e-05,0.0006206893594935536,0.00011109530896646902,0.00409686379134655,4.586767317960039e-05,6.686058623017743e-05
7531299148528635158,scrolling feels like a divorce🙏🏻,0.0007046543760225177,3.662340168375522e-05,0.0002571486111264676,0.00014717051817569882,0.0003150501288473606,6.0517140809679404e-05,3.3810207241913304e-05
7531299148528635158,forse non sanno cos è il dad body,0.008661221712827682,0.00017607315385248512,0.004033276345580816,0.0003147762909065932,0.007539320271462202,0.00027010421035811305,0.00033008126774802804
7531299148528635158,"Come cazzo fate a definire questo “chunky”, ma riprenditi tu e tutti quelli che hanno commentato.",0.9610764980316162,0.003783717518672347,0.6828773617744446,0.002315990859642625,0.6379826664924622,0.002362977946177125,0.05698731169104576
7531299148528635158,I think Moto Moto likes you,0.0018280318472534418,2.9658343919436447e-05,0.000325547851389274,0.0001176385412691161,0.0008693786221556365,6.017806299496442e-05,3.6970093788113445e-05
7531299148528635158,preferisco di gran lunga questo a quelli definiti,0.0008643223554827273,0.0029566148295998573,0.023323746398091316,0.0038256030529737473,0.02168857865035534,0.001647721859626472,0.0007426883094012737
7530576819708267799,oddio la ragazza bendata faceva video su youtube anni fa con la sua ragazza (?),0.6465447545051575,0.003086028154939413,0.16335512697696686,0.008950564078986645,0.06669751554727554,0.0019488252000883222,0.020909041166305542
7530576819708267799,"ma solo io al inizio sento ""io no""",0.0015487404307350516,0.002738230861723423,0.02601972222328186,0.004521200433373451,0.0183582566678524,0.0019138019997626543,0.001072318060323596
7530576819708267799,GIULIA SEI TE???,0.04554223269224167,0.0003797980025410652,0.006717415526509285,0.0017371582798659801,0.007137985434383154,0.0002713030553422868,0.0003207795962225646
7530576819708267799,Ma a me il primo sembrava un elastico per capelli 😅Ahaha,0.003194541437551379,7.625685248058289e-05,0.001754422439262271,0.00015419669216498733,0.00160525506362319,0.000184519580216147,0.00040444909245707095
7530576819708267799,"Oklahoma, e al prossimoooo *TOK*",0.01256911363452673,0.00020179976127110422,0.007059277966618538,0.0003428510681260377,0.004442860838025808,0.0006913896067999303,0.00046771910274401307
7530576819708267799,ma sono fatti con gli ingredienti di plastica,0.002028684364631772,0.0037042847834527493,0.027881860733032227,0.0049551986157894135,0.025707382708787918,0.0017742890631780028,0.0011381680378690362
7530576819708267799,Giuliaaaaa,0.0016675100196152925,4.474132219911553e-05,0.0006267271237447858,0.00010053245932795107,0.0006545512587763369,0.000160640905960463,8.562521543353796e-05
7530576819708267799,"ma è Giuliaaaa, la mia infanzia sta ragazza🥲",0.015448772348463535,0.0003673225874081254,0.004969410132616758,0.0009052943205460906,0.005099346395581961,0.00046452603419311345,0.0020905700512230396
7530576819708267799,"Tranne cipolla, tutto ottimo",0.005409914068877697,0.0001639500114833936,0.003182691056281328,0.0002526967437006533,0.002447225386276841,0.0005687967641279101,0.0006678476347588003
7530576819708267799,EU alto edit,0.004437883850187063,0.0035439308267086744,0.033197227865457535,0.004991455003619194,0.025526493787765503,0.001646210323087871,0.0007152589969336987
7530394040076979478,Cami y Apolo 🤭🫦,0.0004960860824212432,0.005065092351287603,0.03585926443338394,0.006733224727213383,0.02965528890490532,0.001917338464409113,0.0010054694721475244
7530394040076979478,Tati y Apolo,0.0009471799130551517,6.736618524882942e-05,0.0008997125551104546,0.00013264342851471156,0.001978278625756502,7.176658255048096e-05,5.357126792659983e-05
7530394040076979478,italiani ci siete??,0.00923013873398304,3.44861728081014e-05,0.0004397611483000219,0.0024705915711820126,0.001017630915157497,6.955950811970979e-05,4.9074587877839804e-05
7530394040076979478,No es por hacer ship pero la cami y apolo 😻uff 😅 pero amo a tati y apolo a y aparte apolo se nota que verdad le esta gustando tati😻,0.0014865247067064047,0.00036780847585760057,0.006873878184705973,0.0006626428221352398,0.0039466568268835545,0.000266713002929464,0.0002655506250448525
7530394040076979478,yo Ella,0.0008772513247095048,6.687187851639464e-05,0.0008250153623521328,0.0001379066234221682,0.0006219237111508846,0.00010540000948822126,9.443884482607245e-05
7530394040076979478,Sofia y Apolo 😍,0.00033800420351326466,4.396917938720435e-05,0.00032098882365971804,0.00011430349695729092,0.0002948654582723975,5.235646676737815e-05,3.283423211541958e-05
7530394040076979478,Apolo y tati sería una buena pareja esas miradas 🥰,0.0018779176753014326,0.00017444467812310904,0.003709099255502224,0.00032463602838106453,0.00362497684545815,0.00015353837807197124,0.00030305198743008077
7530394040076979478,Más guapos Alvaro y apolo admitirlo,0.0034997796174138784,0.0003117919259238988,0.004941754508763552,0.0003205649845767766,0.005610212218016386,0.0006864608731120825,0.00047717950656078756
7530394040076979478,I felt watched,0.00040585146052762866,3.74338123947382e-05,0.00022156781051307917,0.00010842317715287209,0.0002361792721785605,6.207789556356147e-05,3.470325464149937e-05
7530394040076979478,Alvarito solo es de katteyes,0.002788395853713155,0.002102280268445611,0.019322004169225693,0.003816480515524745,0.022590002045035362,0.0015284132678061724,0.000507999851834029
7530953310128377110,ma perché ha rimandato la sua ahahaga,0.07244854420423508,0.0023920200765132904,0.032314155250787735,0.004226810298860073,0.028247453272342682,0.0013925516977906227,0.001125145354308188
7530953310128377110,Povero mio padrino 🙄🙄🙄,0.001363734481856227,4.4841697672382e-05,0.0005454188212752342,0.00012076048733433709,0.0009465456823818386,4.729562715510838e-05,6.545770884258673e-05
7530953310128377110,chi si ricorda da dove viene questo suono?,0.002278190106153488,0.0016286543104797602,0.02093885838985443,0.0024800579994916916,0.013249925337731838,0.0009397366084158421,0.0004954516189172864
7530953310128377110,"ma che bei tatuaggi, è henna o inchiostro?",0.004834890365600586,0.0014486216241493821,0.02015059068799019,0.0017972438363358378,0.010900398716330528,0.0008405228145420551,0.0012133122654631734
7530953310128377110,😂😂😂,0.0006886054179631174,2.063396641460713e-05,0.00013313318777363747,0.00017001564265228808,0.0002935882948804647,4.2838106310227886e-05,2.3800626877346076e-05
7530953310128377110,😳😳😳,0.0009361275588162243,1.8076076230499893e-05,0.0001678120461292565,0.00011668300430756062,0.0004240987473167479,3.8999594835331663e-05,2.2529884518007748e-05
7530953310128377110,@Mery🩷✨,0.0005898575182072818,1.8199803889729083e-05,0.00015161739429458976,8.588059426983818e-05,0.000297532940749079,3.25650253216736e-05,1.9809511286439374e-05
7530953310128377110,😳😳😳,0.0009361289558000863,1.807609442039393e-05,0.00016781188605818897,0.00011668310617096722,0.00042409898014739156,3.8999667594907805e-05,2.2529884518007748e-05
7530953310128377110,😳😳😳,0.0009361289558000863,1.807609442039393e-05,0.00016781188605818897,0.00011668310617096722,0.00042409898014739156,3.8999667594907805e-05,2.2529884518007748e-05
7530987636941442326,sono solo video🙄,0.0007351677631959319,0.0001299645082326606,0.0013521899236366153,0.00037950518890284,0.0006888594361953437,0.00012526498176157475,8.18627086118795e-05
7530987636941442326,Domenico e alice meglio,0.0025470813270658255,5.600923395832069e-05,0.0007993143517524004,0.00012970835086889565,0.002051458926871419,0.00014753990399185568,0.00010555128392297775
7530987636941442326,"Fabio e Alice bellissimi ma cie' tornata davvero da domenico alice mordenti
allora secondo me Giulia bizzarri è Fabio devono tornare insieme",0.016682403162121773,0.0002990917710121721,0.007892361842095852,0.0010990995215252042,0.013981666415929794,0.0002369786670897156,0.0005471180193126202
7530987636941442326,aia 😬,0.0009816075908020139,3.082794137299061e-05,0.0002799679641611874,0.00014419549552258104,0.0006017475971020758,3.992973506683484e-05,3.0048629923840053e-05
7530987636941442326,Sotto avevo il video di Domenico con Alice,0.0004585432179737836,0.0010414181742817163,0.009829391725361347,0.001130161341279745,0.007833754643797874,0.0005710568511858582,0.0003391366917639971
7530987636941442326,Ma dov’é Giuliaaa???!!!😭😭😭 Giulia lo amava veramente…😭😭😭,0.0015004891902208328,5.995506944600493e-05,0.001044001430273056,0.00013823655899614096,0.0005792872398160398,8.600204455433413e-05,0.00011279770114924759
7530987636941442326,Alice stai lontana che Fabio è mio 💕😤😠,0.005429146811366081,0.0002089209301630035,0.004803244955837727,0.0005080661503598094,0.0035029426217079163,0.00015401052951347083,0.00023175864771474153
7530987636941442326,fabio torna da giulia no??(se potessi farlo ovviamente),0.0025393252726644278,0.0031519203912466764,0.02650481089949608,0.00543632498010993,0.020021768286824226,0.0020466421265155077,0.001005558529868722
7530987636941442326,aliceee mi saluti plis,0.026840779930353165,0.0024964583572000265,0.0315040722489357,0.002171441214159131,0.01906566135585308,0.001898423070088029,0.0012252943124622107
7530987636941442326,era meglio Giulia e fabio ❤️🥰,0.002433932851999998,0.0005889732856303453,0.008203785866498947,0.0011417587520554662,0.005365313496440649,0.0005489017930813134,0.0002606395573820919
7531313905625271574,lei è elisa è lui è il fratello,0.02906949818134308,0.0015676813200116158,0.020721131935715675,0.001757427933625877,0.03321767970919609,0.0008828455465845764,0.0014105667360126972
7531313905625271574,normalizziamo taggare le sorelle,0.008224576711654663,0.0006078882142901421,0.005096379201859236,0.0012381150154396892,0.004639608319848776,0.009258586913347244,0.0015320779057219625
7531313905625271574,alessia ..veramente anch'io le prime l'ho scambiato x un maschio..in effetti sembra un maschio 😅,0.008067958056926727,0.0002360262005822733,0.0010221203556284308,0.0018971693934872746,0.0028617284260690212,0.0006897094426676631,0.0009263146785087883
7531313905625271574,hai dormito dai tuoi genitori?,0.02002326399087906,0.00012027791672153398,0.005678829737007618,0.0003325380093883723,0.008616997860372066,0.00018469119095243514,0.0007358465809375048
7531313905625271574,Sorella?,0.0006255416083149612,2.0818895791308023e-05,0.0001994123012991622,6.317043880699202e-05,0.00037322091520763934,4.5589102228404954e-05,3.47017303283792e-05
7531313905625271574,Fratello “,0.001274668611586094,0.0032782056368887424,0.025319788604974747,0.004891606047749519,0.03282970190048218,0.0015613575233146548,0.0009441188303753734
7531313905625271574,non riuscivo a capire chi fosse la sorella,0.0010834339773282409,6.957264122320339e-05,0.0010870291152969003,0.0001617147063370794,0.0017010908341035247,5.7789700804278255e-05,8.252422412624583e-05
7531313905625271574,"io come te anche quando ne avevo 15 ahahahah, non mi è mai piaciuto andare a ballare",0.04657885804772377,0.0003386845055501908,0.010521686635911465,0.0014787467662245035,0.011489330790936947,0.00031178121571429074,0.0014359381748363376
7531313905625271574,"io uguale a te,a 18 anni😅",0.004312844481319189,0.00011819139763247222,0.002683250932022929,0.00023733277339488268,0.0030269885901361704,0.0001295333495363593,0.00023286993382498622
7531313905625271574,Sorella ?,0.0009065018384717405,1.8726121197687462e-05,0.00021209272381383926,5.641007373924367e-05,0.0005453956546261907,4.3415111576905474e-05,3.722296969499439e-05
7532181013196311830,e la stessa frase che mi sono detto al ritorno dalle vacanze a napoli,0.002286764094606042,0.0008173375972546637,0.012484113685786724,0.0016441317275166512,0.008448777720332146,0.00044256445835344493,0.0003163802030030638
7532181013196311830,@emy🦋 voglio ritornare a Londra,0.00038233475061133504,3.455787737038918e-05,0.00023412735026795417,0.00011739290494006127,0.0002811714366544038,3.938658119295724e-05,3.144194488413632e-05
7532181013196311830,non lo penso mai perché gli italiani sono ovunque e quindi ovunque mi capiscono,0.005484533961862326,0.00011049246677430347,0.001400340930558741,0.004415981471538544,0.001837722142226994,0.0001388961391057819,8.237264410126954e-05
7532181013196311830,"a me è successo in giappone: stavamo parlando in italiano convinti che nessuno ci capisse, poi nel bel mezzo della conversazione una signora sulla metro asiatica, come scende, ci agura buone vacanze 😂",0.002280208980664611,4.573772457661107e-05,0.0007542655221186578,0.00023753062123432755,0.0007759956642985344,0.0001002533026621677,0.00022915075533092022
7532181013196311830,raga una volta ho sparlato di uno mi viene dietro dicendo “vedi che sono italiano”……,0.019691210240125656,0.00013164759729988873,0.004303795285522938,0.0027570873498916626,0.0029302253387868404,0.0002435895730741322,0.00036762654781341553
7532181013196311830,starei per sempre in viaggio a costo di parlare sempre inglese,0.028232142329216003,0.0006401946302503347,0.009695039130747318,0.0035016159527003765,0.008879597298800945,0.0015469894278794527,0.00046395821846090257
7532181013196311830,@kia⸆⸉🪩 @@aurora✰ quando siamo atterrate a napoli,0.001493003568612039,0.00010369291703682393,0.0017504666466265917,0.00021279481006786227,0.001191966701298952,0.0001941067021107301,8.830038859741762e-05
7532181013196311830,stessa cosa che dico dopo essere tornato a Bari da un villaggio estivo,0.0024900496937334538,0.000327116169501096,0.005416668485850096,0.0008392063318751752,0.0034789908677339554,0.0001998474181164056,0.0002110218338202685
7532181013196311830,"quando ritorno in Albania ""ora se parliamo albanese ci linciano""",0.5356149673461914,0.0007288011256605387,0.005952011328190565,0.2784736752510071,0.011870100162923336,0.09681665152311325,0.002363059902563691
7532181013196311830,"In Albania sei fregato , e come se fossi la seconda madre lingua 😅👋",0.7611449956893921,0.0038496688939630985,0.1984061449766159,0.019749660044908524,0.08887088298797607,0.0012576064327731729,0.013656822964549065
7531748821500579094,una non perfetta non ce,0.010410436429083347,0.0011579848360270262,0.016325021162629128,0.002819715067744255,0.02463233843445778,0.0009125475771725178,0.0003441529697738588
7531748821500579094,10€….,0.0004800356400664896,1.96151522686705e-05,0.00012569825048558414,8.117644756566733e-05,0.00022541635553352535,3.882929740939289e-05,2.0859157302766107e-05
7531748821500579094,che giocatore che sei Maurizio,0.05276229605078697,0.0008601921726949513,0.014960586093366146,0.0013964740792289376,0.022609777748584747,0.0006571614649146795,0.00047600403195247054
7531748821500579094,Bellissime ma immagino che scarseggino i maschietti qualcuna rimarrà insoddisfatta,0.018907781690359116,0.00011047024599974975,0.0008964143344201148,0.0016401776811107993,0.006554880645126104,0.0010877023451030254,0.0004782949690707028
7531748821500579094,Ma sono tutte perfette aiuto 😍🥹,0.0016146562993526459,0.0002941996790468693,0.005954116117209196,0.0004483602533582598,0.0026728943921625614,0.00018798607925418764,0.00018848358013201505
7531748821500579094,"un po come il baratto, dai qualcosa in cambio di qualcosa. la situazione pressoché questa",0.0035908103454858065,0.00029507806175388396,0.005521352402865887,0.000345725187798962,0.004835059866309166,0.00047340872697532177,0.00032962876139208674
7531748821500579094,Maradona di nome e di fatto,0.008743321523070335,0.0004761705349665135,0.009074805304408073,0.001236039912328124,0.008612070232629776,0.0004616391088347882,0.000602663669269532
7531748821500579094,il paradiso lo immagino proprio così..,0.0009805546142160892,3.412324076634832e-05,0.00042078757542185485,0.0001304446195717901,0.0003748638555407524,5.914895155001432e-05,5.698752647731453e-05
7531748821500579094,non ho capito 😅,0.001029162434861064,0.0007658562972210348,0.009883490391075611,0.0013329547364264727,0.007840272970497608,0.0004090863512828946,0.00020744076755363494
7531748821500579094,la bionda👌,0.0032581277191638947,7.251678471220657e-05,0.0012422706931829453,0.00016143139509949833,0.0016528471605852246,0.00035274834954179823,0.00021080243459437042
7531061280166153494,ma la vera domanda è perche va in giro conciato co la maglietta alzata cosi?,0.04628878831863403,0.0001777602155925706,0.0053883944638073444,0.0007211039192043245,0.01602601818740368,0.0016494902083650231,0.0014657136052846909
7531061280166153494,non vedo più Edo con gli stessi occhi,0.0018939673900604248,0.0001311670639552176,0.0018890448845922947,0.00026605138555169106,0.001713507459498942,0.00020529641187749803,0.00015458432608284056
7531061280166153494,quando è spuntato il signore dall’ascensore aiutoo,0.012436007149517536,0.00013345666229724884,0.002084873616695404,0.0004383767955005169,0.004667786881327629,0.0017368515254929662,0.0011175419203937054
7531061280166153494,lei infastiditissima hahah,0.33252739906311035,0.0006737476214766502,0.033749885857105255,0.002541974186897278,0.13159042596817017,0.001472532982006669,0.001444086548872292
