video_id,comment,toxicity,severe_toxicity,obscene,identity_attack,insult,threat,sexual_explicit
7532868256961432854,io quando andavo al mare lo piantavo il primo giorno e lo toglievo a fine vacanza,0.007080587558448315,0.00023494644847232848,0.004088079556822777,0.0002904800057876855,0.0011693108826875687,0.0019363720202818513,0.0006551881670020521
7532868256961432854,Ci fosse questa energia per gli stabilimenti abusivi 😝,0.003387788077816367,6.597326864721254e-05,0.000987155013717711,0.00015077601710800081,0.0010533183813095093,0.00033783348044380546,0.00013018789468333125
7532868256961432854,"io scendo alle 6, pianto l'ombrellone e porto la sdraio anche per mia madre, poi vado a camminare sulla riva. che si fa? al ritorno non trovo la mia roba?",0.031056860461831093,0.00017377777840010822,0.005036204122006893,0.000792754057329148,0.0036198878660798073,0.002570273820310831,0.001808390486985445
7532868256961432854,alle 6 mio marito va per mettere gli ombrelloni e prendere il posto avanti perché ho 2 bimbi che non sono mattinieri arriviamo sempre verso le 9 e posti non ce ne sono più... per noi è comodo fare così .. allora è giusto secondo voi che piantano un gazebo occupando una piazzola... e togliendo lo spazio ad altri... ma dai,0.0025823605246841908,7.362440373981372e-05,0.0011895688949152827,0.0001468551199650392,0.0008170798537321389,0.000357512995833531,0.0003599258197937161
7532868256961432854,e se vado a fare la camminata sulla spiaggia? un anno mi è capitato sono arrivato presto ho messo l'ombrellone e la salvietta sono andati a camminare torno e non c'è più! andassero negli stabilimenti balneari a fare i controlli,0.0019642256665974855,0.00015794433420524,0.0035581951960921288,0.0001778019213816151,0.0014648295473307371,0.0002290432748850435,0.0002803828101605177
7532868256961432854,Una magica domenica di luglio andiamo a mare è una turista piazzo gli ombrelloni e se ne andò noi siamo arrivati e abbiamo trovato questi ombrelloni chiusi e si era presa una spiaggia sono arrivata io e mi sono piazzata accanto l’ombrellone quando la signora è arrivata a aperto l’ombrellone e l’ombra arrivava a mia figlia lei tutta arrabbiata chiude l’ombrellone così la prossima volta si impara a piazzarsi e andarsene,0.003245636587962508,6.623083027079701e-05,0.0010829463135451078,0.00020300844334997237,0.0007798036676831543,0.00015210190031211823,0.0005049146129749715
7532868256961432854,"Allora ricapitolando… se arrivo la Matt presto e metto l’ombrellone e reato ma, se occupo un intera spiaggia per 6 mesi senza che nessuno mi abbia dato la concessione e non to fatto alcun bando di concorso per averla e tutto regolare… giusto ???",0.002624906599521637,6.221924559213221e-05,0.0012034171959385276,9.587586828274652e-05,0.001061225077137351,0.0002616469282656908,0.00014893260959070176
7532868256961432854,Quindi non mi posso nemmeno allontanare a fare una nuotato o andare al bar a fare colazione?,0.008733941242098808,0.0001749208604451269,0.0038748423103243113,0.0003189608396496624,0.001337811816483736,0.0005718229222111404,0.004396727774292231
7532868256961432854,"l'attrezzatura balneare in spiaggia libera può stare dall'alba al tramonto se non esistono ordinanze comunali particolari che non vadano in conflitto con il demanio...per cui a mio avviso una persona che pianta il suo ombrellone alle 05:00 del mattino e poi va a casa e torna alle 10:00 è liberissimo di farlo, basta che al tramonto levi tutto",0.0010907223913818598,2.942432001873385e-05,0.00025691112386994064,7.679116242798045e-05,0.00024770217714831233,0.00016286168829537928,5.306247840053402e-05
7532868256961432854,"Anche l,'altro giorno,arrivo in spiaggia e trovo 3/4 ombrelloni chiusi,sapete a che ora ho visto 2di quelli?alle 11.00.Ora con altri ci siamo organizzati,andiamo in spiaggia alle 5 e buttiamo tutti gli ombrelloni chiusi in mare,molto lontano, però......🤗",0.0012415371602401137,9.025921463035047e-05,0.0008745097438804805,0.00017842331726569682,0.0003681911912281066,0.00038503448013216257,0.00011601299775065854
7532545322627714326,raga non ho capito 😭,0.0009557883604429662,0.0006065639900043607,0.008283007889986038,0.0010639451211318374,0.005476011894643307,0.00032826329697854817,0.00019573309691622853
7532545322627714326,l’acqua micellare la uso pure io,0.018155014142394066,0.0021776489447802305,0.023244988173246384,0.0031325537711381912,0.017077064141631126,0.0022055075969547033,0.0009021418518386781
7532545322627714326,nel tempo libero fa il makeup artist,0.0021162028424441814,0.0018142323242500424,0.019804518669843674,0.002643497660756111,0.016714394092559814,0.001222943770699203,0.0009728242293931544
7532545322627714326,vabbè dai meglio così che un solo flacone di bagnoschiuma innaquato 🤮🤮come si fa ad essere così schifosi?,0.7482464909553528,0.0010118111968040466,0.2727418541908264,0.0015212014550343156,0.23573657870292664,0.0004711797519121319,0.0015418481780216098
7532545322627714326,✨Aveva shampoo e balsamo di Chiara nasti ✨,0.004993624519556761,0.002851938595995307,0.030089683830738068,0.004614405333995819,0.027850206941366196,0.0011572999646887183,0.0009313151822425425
7532545322627714326,Sis ci sono 5 spazzolini in quel bagno. CINQUE. E dice di vivere da solo. Io scapperei. 🙂,0.11012724041938782,0.00026865722611546516,0.004404518287628889,0.0003049678052775562,0.02687714248895645,0.028882240876555443,0.0031251099426299334
7532545322627714326,è il kit di cortesia per le ragazze che vanno a trovarlo!,0.007106272503733635,5.5282620451180264e-05,0.0010406258516013622,0.0004778486327268183,0.0018549240194261074,0.00035725149791687727,0.000598507875110954
7532545322627714326,"Ho amici che tengono lo struccante e qualche prodotto per noi povere sfigate amiche che ogni tanto ci ritroviamo a piangere sulla sua spalla disperate dalla vita. Sicuramente nella maggior parte dei casi non è così, ma ci sono anche le eccezioni",0.3373905122280121,0.0002060514088952914,0.02411721460521221,0.0008808911079540849,0.2597389817237854,0.00044933598837815225,0.0026470075827091932
7532545322627714326,✨ IL WEEKEND FACCIO IL CLOWN✨,0.5228208303451538,0.003386144759133458,0.06555836647748947,0.005971039645373821,0.05989578738808632,0.0017907182918861508,0.004205156117677689
7532545322627714326,Commento affinché l’algoritmo faccia arrivare il video alla ragazza che riconoscerà il bagno e i suoi prodotti 🤞🏻😂,0.0012028046185150743,3.481602107058279e-05,0.0003795931115746498,0.00015551559044979513,0.0004527681740000844,5.997782864142209e-05,0.00016350990335922688
7532510275002535191,La cattiva è che non è il Nuvolau,0.0403904989361763,0.00016174186021089554,0.005519569385796785,0.001649181474931538,0.033443383872509,0.000227977434406057,0.0001890920102596283
7532510275002535191,"oddio sembra un rifugio in val di fassa 😅😅
che rifugio è?!?!😌",0.005269428249448538,0.00010698433470679447,0.0028293731156736612,0.0003021320153493434,0.0024257726036012173,0.00017845667025540024,0.00018706414266489446
7532510275002535191,"Dai, ancora mezz’ora ed arrivi",0.005831072572618723,0.0003938627487514168,0.0063699595630168915,0.0004213739885017276,0.005204361397773027,0.002124318154528737,0.0004563089751172811
7532510275002535191,dal giau all'averau sentiero super carino molto entry level secondo me adatto a tutti 🥰,0.000844482216052711,0.0007028241525404155,0.008445954881608486,0.00115225650370121,0.005505476612597704,0.0004196742665953934,0.00024541743914596736
7532510275002535191,se non si vede sei vicino nella mia logi9,0.004458463750779629,0.003996622283011675,0.030419260263442993,0.006579438224434853,0.024074051529169083,0.0029976004734635353,0.0013660378754138947
7532510275002535191,Fr💔 tutti ci hanno detto “ancora un quarto d’ora e siete la” non era vero (ci abbiamo messo altre 2 ore😭🙏),0.0038194223307073116,7.487892435165122e-05,0.002411528257653117,0.00019928229448851198,0.001878119888715446,9.034153481479734e-05,0.0001431954005965963
7532510275002535191,sentiero dal giau all’averau giusto?,0.0013171930331736803,0.0003841669822577387,0.00505324499681592,0.0006751485634595156,0.004214547108858824,0.0003986308875028044,0.00029894610634073615
7532510275002535191,"mia mamma quando eravamo andati sulle dolomiti(era estate)nn c'era la neve e praticamente stavamo scendendo giù per sto sentiero molto dritto,e praticamente ad un certo punto lei inizia a slittare dall' altra parte del sentiero giù per la dirupe!!!
io ero così:👁️👄👁️(((((((nn si è fatta nulla)))))))😂",0.0028897211886942387,0.00017438645591028035,0.004620331339538097,0.00026946503203362226,0.001055775210261345,0.00016205909196287394,0.00034785098978318274
7532510275002535191,ancora due curve e arriviamo o senó dopo questa curva si inizia a vedere,0.3853539228439331,0.0017546345479786396,0.01798289082944393,0.00113656185567379,0.010345363058149815,0.007627787999808788,0.32616183161735535
7531041274204294422,Catherine,0.0007014102884568274,3.915077104466036e-05,0.00030362315010279417,0.00013708118058275431,0.0005237514851614833,4.848923708777875e-05,2.9606941097881645e-05
7531041274204294422,Silicon Valley,0.0005198100116103888,3.0654508009320125e-05,0.00024391399347223341,0.00010804378689499572,0.00031159789068624377,4.5163007598603144e-05,2.7698031772160903e-05
7531041274204294422,20euro,0.0004064655804540962,2.5313111109426245e-05,0.00017383744125254452,9.300445526605472e-05,0.00026041650562547147,4.0972652641357854e-05,2.2284679289441556e-05
7531041274204294422,chissà cosa si prova a essere così,0.012896443717181683,0.0006504785269498825,0.015448757447302341,0.0012342705158516765,0.00952902715653181,0.0005369558930397034,0.0004615823272615671
7531041274204294422,Too much,0.0004918024642392993,2.2615127818426117e-05,0.0001432846038369462,9.000240243040025e-05,0.00023227410565596074,3.967398515669629e-05,2.2644931959803216e-05
7531041274204294422,look at me i need to be noticed 😂 how about a natural pose instead,0.001449831877835095,9.757369116414338e-05,0.0011580267455428839,0.00017931188631337136,0.0002620998420752585,0.00023546427837572992,0.0002668185334187001
7531041274204294422,Sculpted to perfection by hard work 🥰,0.0005872115725651383,3.9535865653306246e-05,0.00026716626598499715,0.00010849517275346443,0.00025688466848805547,6.3115636294242e-05,4.138043732382357e-05
7531041274204294422,Look at me 🙄,0.0007112547173164785,4.13413108617533e-05,0.00027190925902687013,0.000170091530890204,0.00016736635006964207,7.643186108907685e-05,3.313699926366098e-05
7531041274204294422,I want a white girl,0.10130684822797775,0.0007871530833654106,0.0018878020346164703,0.11540518701076508,0.003425095696002245,0.0009688931168057024,0.0014634227845817804
7531041274204294422,never been a fan of silicon valley 😅,0.0016506549436599016,1.562635588925332e-05,0.00013344164472073317,0.00014752964489161968,0.00063270766986534,2.375532130827196e-05,1.5997513401089236e-05
7532454117671718166,PAOLO ZORZI,0.16325049102306366,0.00028470216784626245,0.005256031174212694,0.0008775016758590937,0.12837012112140656,0.0012853904627263546,0.00069203763268888
7532454117671718166,A Malta a 40 anni a meno che non dovesse cantare o roba di lavoro è grave eh,0.03649887815117836,0.00011887635628227144,0.0026693944819271564,0.007082703523337841,0.009490902535617352,0.00023219439026433975,0.00024298021162394434
7532454117671718166,la domanda è: siete voi che volate su aerei da ricchi o è Gue sullo spostapoveri?,0.015270096249878407,8.623831672593951e-05,0.0033316747285425663,0.0004683486185967922,0.009382298216223717,0.000151250627823174,0.00033986024209298193
7532454117671718166,il mio posto in aereo è 1A,0.0012792502529919147,0.0001809614768717438,0.0022413937840610743,0.0004314373363740742,0.0015833216020837426,0.00026148383039981127,0.00012232332665007561
7532454117671718166,Non so neanche chi sia….🤣,0.0004938103957101703,2.62161556747742e-05,0.00024299713550135493,8.770173008088022e-05,0.0002896531077567488,3.13019918394275e-05,2.3719281671219505e-05
7532454117671718166,Il che me lo ritrovo in giro per Lugano,0.006819438189268112,0.0003167997347190976,0.005719286855310202,0.0006760315736755729,0.0035333719570189714,0.0008138992125168443,0.0004116000491194427
7532454117671718166,e ci credo con quel bodyguard manco io avrei chiesto la foto,0.19156120717525482,0.004724226426333189,0.04700479283928871,0.004838273394852877,0.07923173159360886,0.004786602687090635,0.0029536420479416847
7532454117671718166,capirai chi hai incontrato,0.0028884022030979395,0.0009365763398818672,0.014072251506149769,0.0017541267443448305,0.011178446933627129,0.0007077361224219203,0.00036496910615824163
7532454117671718166,AVETE FATTO I COMPITI DELLE VACANZE?😾📚,0.08278708904981613,0.002955726580694318,0.029752178117632866,0.0038178730756044388,0.036047905683517456,0.0014830606523901224,0.0017853700555860996
7532454117671718166,io a gallipoli ero nel suo stesso hotel e 2 giorni prima c’era nikysavage,0.0013772090896964073,0.0008103363797999918,0.010342315770685673,0.0013546963455155492,0.0064138807356357574,0.0003876753035001457,0.0004133686888962984
7532466118292720918,Raga non capisco se sia un fanpage o è lui davvero AHHAAJJAA,0.03534524142742157,0.0006777307717129588,0.011020330712199211,0.0020193944219499826,0.018026284873485565,0.0007707139011472464,0.000802788301371038
7532466118292720918,Simone é un esperimento sociale,0.23375464975833893,0.0002147498744307086,0.004592782352119684,0.0004731606168206781,0.19543220102787018,0.00046896087587811053,0.0008482270059175789
7532466118292720918,LA CANZONE STO PIANGENDO,0.26167187094688416,0.0011171045480296016,0.01671784371137619,0.006577147636562586,0.04826141521334648,0.004795667715370655,0.0014009358128532767
7532466118292720918,RAGA E INCINTA SONIA AHAHAHA,0.17038780450820923,0.002917167032137513,0.03137127682566643,0.0032059086952358484,0.03443743661046028,0.0015755872009322047,0.0019671726040542126
7532466118292720918,sai cosa succede 1 agosto,0.009662342257797718,0.0040688468143343925,0.04077424854040146,0.0063635436818003654,0.025893516838550568,0.0016783119644969702,0.0007541130762547255
7532466118292720918,RAGA AMO ULTIMO MA SPACCA STA VERSIONE,0.19093766808509827,0.005256724078208208,0.03450718894600868,0.004064756445586681,0.03293153643608093,0.0018033062806352973,0.002539889421314001
7532466118292720918,Hai perso una Donna speciale e non te ne sei accorto !!!,0.00727409403771162,5.288481042953208e-05,0.0005129558849148452,0.0007192172924987972,0.00285789230838418,9.616429451853037e-05,0.00024115529959090054
7532466118292720918,Vivre ogni m’mento al masshimo,0.026578806340694427,0.0008997631957754493,0.00840014684945345,0.0019162019016221166,0.004409353248775005,0.01154506579041481,0.0008588367491029203
7532466118292720918,Se è davvero lui voglio stringergli la mano! 😂😂😂,0.040618106722831726,0.0003058159491047263,0.0012113733682781458,0.0011443120893090963,0.0005999791319482028,0.049458786845207214,0.0009853170486167073
7532466118292720918,"MA LA CANZONE È MODIFICATA, VERO?!",0.015409836545586586,0.00023457914358004928,0.00265064206905663,0.0007749540964141488,0.006191766820847988,0.0006124688079580665,0.00016488941037096083
7531254643029069088,passat present futur,0.0006817153189331293,0.0012996596051380038,0.01161467470228672,0.0015742928953841329,0.008189694955945015,0.0007252824725583196,0.00034705668804235756
7531254643029069088,E passat a Porsche ?,0.0006203179946169257,3.241734884795733e-05,0.0002994261449202895,9.088434308068827e-05,0.00029311003163456917,6.385720917023718e-05,3.8856003811815754e-05
7531254643029069088,Ca passat?,0.002009814139455557,4.807132063433528e-05,0.001024530385620892,0.00011215845734113827,0.0009670799481682479,0.00011009177251253277,7.763983740005642e-05
7531254643029069088,Romanian Porsche,0.0010968209244310856,0.00011170015204697847,0.0012972955591976643,0.0004660095146391541,0.0014047701843082905,7.596304931212217e-05,7.140907109715044e-05
7531254643029069088,Way better than a Porsche,0.0005130774225108325,2.5092069336096756e-05,0.00014361424837261438,9.059153671842068e-05,0.00025451357942074537,3.761796688195318e-05,2.3219341528601944e-05
7531254643029069088,FERRARI,0.08355774730443954,0.00012094982230337337,0.003434761194512248,0.00025968856061808765,0.07071429491043091,0.000838508945889771,0.00047761868336237967
7531254643029069088,These comments😂😭,0.0007700774003751576,2.313793265784625e-05,0.00015185540542006493,0.00014662269677501172,0.00029809967963956296,4.237116081640124e-05,2.005764326895587e-05
7531254643029069088,псат,0.01752973161637783,0.0005486570298671722,0.01432777475565672,0.0005704144132323563,0.012651505880057812,0.0013866282533854246,0.0018453854136168957
7531254643029069088,красавец перевод супер.,0.008003690280020237,0.0002150933287339285,0.003981557209044695,0.0003264292317908257,0.005567165557295084,0.0003098681045230478,0.0004172171466052532
7532501194552380679,Ma solo a me dà un senso di fastidio “interno” farlo?,0.0026456760242581367,0.00016815561684779823,0.0038189322222024202,0.0002573239617049694,0.0021308427676558495,0.0002174649853259325,0.0002833514881785959
7532501194552380679,"a me si muove anche l'orecchio destro insieme al mignolo
ma è normale?",0.009558487683534622,0.00022166140843182802,0.004552079830318689,0.0003708983713295311,0.004968087654560804,0.0008776112808845937,0.001165865221992135
7532501194552380679,"Per coloro che non capiscono e hanno bisogno di ulteriori spiegazioni, vorrei spiegarlo nel modo più completo possibile. Dato che mi sono preso il tempo di imparare e studiare seriamente l'argomento, sono sicuro che chiunque ascolti questa spiegazione sarà in grado di capirla facilmente. Cercherò di usare il linguaggio il più facilmente possibile e cercherò di evitare i termini tecnici che potrebbero confonderlo in modo che tutti possano applicarlo e trasmetterlo correttamente.
Prima di tutto, bisogna capire che tutto nel mondo, sia naturale che artificiale, ha sempre un posto dove andare, nulla accade irrazionalmente, tutto è logico e scientificamente spiegabile, e come persona che ha studiato e rivisto questi dati per molto tempo, sono pronto a spiegarti questo nel modo più dettagliato.
Spiegarlo scientificamente richiede l'uso di dati e principi comprovati. I principi che spiegherò non sono solo parole senza peso o storie che non lo supportano. Cercherò di illustrare e utilizzare il ragionamento scientifico in modo che tutti possano capirlo facilmente e certamente applicarlo.
Te lo garantisco, nessuno può spiegarlo facilmente come me. Che sia per motivi di fisica, chimica, biologia o anche matematica, sono pronto a darti esempi relativi alla vita di tutti i giorni. Ma in questo caso, per darti un breve riassunto e una spiegazione scientifica più semplice, devo dire che ha la spiegazione più ovvia, e la risposta è, non lo so.",0.00042454065987840295,0.0012039956636726856,0.010204911231994629,0.0012757520889863372,0.0076869274489581585,0.0006396691896952689,0.0002949146437458694
7532501194552380679,Ma su che basi dici che previene l’alzheimer?,0.0018248396227136254,0.0005615400732494891,0.00144581135828048,0.0009311141329817474,0.0015714616747573018,0.0011377090122550726,0.0006991885602474213
7532501194552380679,A me si muove un po’ a scatti 😱,0.00613380316644907,0.00013967922131996602,0.004997853189706802,0.00022468098904937506,0.0024381910916417837,0.00037645321572199464,0.0004346251080278307
7532501194552380679,"ma a me tipo mi si muove a scatti come se si spostasse l’osso tipo,come se sbattesse un po’",0.23646394908428192,0.001180221326649189,0.022831175476312637,0.0028751473873853683,0.0837591215968132,0.017310433089733124,0.013327781111001968
7532501194552380679,C’è chi ha iniziato a farlo e chi mente,0.0064585404470562935,0.0001734465331537649,0.002285998547449708,0.0002382296515861526,0.009426587261259556,0.0003146850795019418,0.00015215673192869872
7532501194552380679,Io che ho il dito a scatto,0.0032535658683627844,0.0006241947994567454,0.00637993635609746,0.0010476091410964727,0.003573609748855233,0.0014754054136574268,0.0006740938406437635
7532501194552380679,Il problema è l'altrosi.Noin riesco alla perfezione.😅,0.004952923394739628,0.0001466882968088612,0.0033614886924624443,0.0003407886251807213,0.0022906556259840727,0.000550139753613621,0.00037475593853741884
7532501194552380679,da quale manuale scientifico proviene questa scoperta,0.00734237115830183,0.0010695169912651181,0.018849560990929604,0.0013851235853508115,0.014163600280880928,0.000814077677205205,0.00048019009409472346
7532166445820661014,fit check per andare alla coop a fare la spesa iniziamo:,0.00201579206623137,6.175757152959704e-05,0.0006619557389058173,0.00014159850252326578,0.000678216340020299,0.0003510580281727016,0.00011973414075328037
7532166445820661014,Team Alice mordenti,0.12072645127773285,0.00014245181228034198,0.001424296642653644,0.0004896953469142318,0.04203483834862709,0.015210740268230438,0.0004165014252066612
7532166445820661014,cosa succede il 1 agosto ?,0.0010540371295064688,0.001130608725361526,0.01618647761642933,0.0017452335450798273,0.00903160311281681,0.0006740122335031629,0.00047016021562740207
7532166445820661014,ma solo io la vedo alta🤨?,0.0015704930992797017,0.003016870701685548,0.02774837240576744,0.00489868363365531,0.02438490465283394,0.0017340511549264193,0.0006224304670467973
7532166445820661014,MA DOVE VAI A 14 ANNI😂😂😂,0.09945866465568542,0.0019325836328789592,0.025023380294442177,0.002676582895219326,0.015523056499660015,0.0014495323412120342,0.0019050028640776873
7532166445820661014,[photo],0.00017441672389395535,0.0001562670076964423,0.0010168143780902028,0.0002656339493114501,0.00062783487373963,0.00012700899969786406,7.331193774007261e-05
7532166445820661014,[photo],0.00017441672389395535,0.0001562670076964423,0.0010168143780902028,0.0002656339493114501,0.00062783487373963,0.00012700899969786406,7.331193774007261e-05
7532166445820661014,[photo],0.00017441672389395535,0.0001562670076964423,0.0010168143780902028,0.0002656339493114501,0.00062783487373963,0.00012700899969786406,7.331193774007261e-05
7532166445820661014,io appena vedo Alice Mordenti: [photo],0.001039855764247477,0.003525295527651906,0.02873598225414753,0.005467392038553953,0.02239381894469261,0.001419252366758883,0.0007615290232934058
7532166445820661014,Da quando Alice mordenti è diventata cosi alta😅,0.05174606293439865,0.00013094960013404489,0.0017806489486247301,0.0005282281199470162,0.016292035579681396,0.008832531981170177,0.0016334085958078504
7532150805147815190,Sabrina di francesco SARNATARO?,0.032564423978328705,0.0014503096463158727,0.025471337139606476,0.003751237876713276,0.04526469483971596,0.0011232690885663033,0.0008821325609460473
7532150805147815190,"Comunque nessuno ha chiesto l’opinione di nessuno per la bravura del cantante. E non è stato niente tutto preparato come pensano alcuni . Geolier fin dall’inizio del video si vede che gesticola con qualcuno dicendo “ non ti sento , che stai dicendo ?” Ma lui non capendo che stesse succedendo ha continuato a cantare. Nel frattempo la sicurezza aveva già iniziato a cercarla ed è per questo che si è trovata poco dopo che lui ferma la musica . Ha fermato tutto una volta che ha realizzato cosa stesse accadendo. Di certo non puoi fermare un concerto tutte le volte che qualcuno gesticola . Ma durante tutto il concerto chiedeva alla sicurezza di distribuire acqua a tutti ogni volta che vedeva flash alzati e muoversi ripetutamente.",0.0006464977050200105,2.2065487428335473e-05,0.00019022134074475616,8.746654202695936e-05,0.0002589171926956624,2.9938333682366647e-05,3.2854906748980284e-05
7532150805147815190,M solo io ho sentito l urlo di Francesco sarnataro 😂,0.0058014788664877415,0.00017710767860990018,0.0045167081989347935,0.0004493417509365827,0.0026433770544826984,0.0007036944152787328,0.000632162147667259
7532150805147815190,il perché c'è Geolier al top delle classifiche e lo stesso motivo del perché c'è la Meloni al governo!,0.002425200305879116,4.6489112719427794e-05,0.000931722519453615,0.00017003055836539716,0.0013569315196946263,0.00010528208804316819,0.00011487366282381117
7532150805147815190,Che cos’è?,0.0012767743319272995,0.00020968866010662168,0.0033165039494633675,0.0003034755645785481,0.0016133561730384827,0.000195395783521235,0.00013204739661887288
7532150805147815190,e pagano pure per vederlo..😡😡😡,0.019641345366835594,0.00017941708210855722,0.004798597656190395,0.00016421974578406662,0.005737684201449156,0.0009854636155068874,0.00044541069655679166
7532150805147815190,vestito egregiamente 😂😂😂🤭,0.0015821144916117191,0.000371626258129254,0.004920726642012596,0.0009312538895756006,0.004281541332602501,0.0002733933215495199,0.00019627732399385422
7532150805147815190,non amo sta tipologia di musica e tanto meno Geolier...ma in questo video tanto di cappello...mi ricordo quando facevo servizio di sottopalco con tanti concerti fatti uno in particolare di Gianni Morandi che fermo il concerto perché si accorse che dei diversamente abili erano in posizione non proprio consona e fece spostare tutte le persone in prima fila compreso il sindaco di Trieste per mettere loro in prima fila...la classe non è acqua😉,0.0021179555915296078,4.422646088642068e-05,0.0009480502922087908,0.0001247401669388637,0.0009730365709401667,4.0854702092474326e-05,0.00011698737944243476
7532150805147815190,E' rivoltante...un insulto alla musica ..,0.1259668469429016,6.22241132077761e-05,0.0018651382997632027,0.0001566453283885494,0.08617972582578659,0.00038216946995817125,0.00024565085186623037
7532228368503344386,brutta posizione la sposa🤦,0.05036449059844017,0.00019962346414104104,0.009289869107306004,0.0001647577155381441,0.01661013439297676,0.0010015906300395727,0.0026996403466910124
