video_id,comment,toxicity,severe_toxicity,obscene,identity_attack,insult,threat,sexual_explicit
7526306988985224470,ma chi e sto matteo poi,0.06395495682954788,0.002502304967492819,0.03347993269562721,0.005316674243658781,0.028330601751804352,0.0030738848727196455,0.002304206369444728
7526212982758575415,Darling hold my hand ! [photo],0.00043633210589177907,3.3685915695969015e-05,0.0002872604818549007,8.757378236623481e-05,0.0001792529074009508,6.435138493543491e-05,3.766219015233219e-05
7526212982758575415,Please be careful with them. They're IVDD prone!,0.0010590637102723122,2.3803620933904313e-05,0.00014192941307555884,0.00011762160283979028,0.0003813657385762781,6.970984395593405e-05,2.939035948656965e-05
7526212982758575415,MY SHAYLAAAAA 😭,0.008397454395890236,0.00013303534069564193,0.0026680580340325832,0.0007156284991651773,0.0017840787768363953,0.00013334827963262796,9.587870590621606e-05
7526212982758575415,Pa que empujai 🗣️‼️‼️,0.0065296003594994545,0.0003059492155443877,0.006086948327720165,0.0005814190953969955,0.004784268327057362,0.0004860042536165565,0.00023895165941212326
7526212982758575415,Father help vibe,0.0006465716869570315,2.2033653294784017e-05,0.00017047228175215423,0.0001045220487867482,0.0003312915505375713,4.7123245167313144e-05,3.4274766221642494e-05
7526212982758575415,Dê like e observe a mágica ██████████████████████████████████████████████████████████████████████████████████████████████████████████████████████████████████████████████████████████████████████████████████████████████████████████████████████████████████████████████████████████████████████████████████████████████████████████████████████████████████████████████████████████████████████████████████████████████████████████████████████████████████████████████████████████████████████████████████████████████████████████████████████████████████████████████████████████████████████████████████████████████████████████████████████████████████████████████████████████████████████████████████████████████████████████████████████████████████████████████████████████████████████████████████████████████████████████████████████████████████████████████████████████████████████████████████████████████████████████████████████████████████████████████████████████████████████████████████████████████████████████████████████████████████████████████████████████████████████████████████████████████████████████████████████████████████████████████████████████████████████████████████████████████████████████████████████████████████████████████████████████████████████████████████████████████████████████████████████████████████████████████████████████████████████████████████████████████████████████████████████████████████████████████████████████████████████████████████████████████████████████████████████████████████████████████████████████████████████████████████████████████████████████████████████████████████████████████████████████████████████████████████████████████████████████████████████████████████████████████████████████████████████████████████████████████████████████████████████████████████████████████████████████████████████████████████████████████████████████████████████████████████████████████████████████████████████████████████████████████████████████████████████████████████████████████████,0.0006850159261375666,0.003793724114075303,0.023180507123470306,0.006763300392776728,0.01720130257308483,0.0014648142969235778,0.0009534073178656399
7526212982758575415,WAS SHE OKAY!!??!?,0.003227021312341094,6.516399298561737e-05,0.0005260042962618172,0.00034870614763349295,0.0007369329105131328,8.776715549174696e-05,0.00016354749095626175
7526212982758575415,The video cut was perfect lol,0.0007206618320196867,3.7391248042695224e-05,0.00030367090948857367,0.00016776069242041558,0.00021422920690383762,6.618884799536318e-05,4.214363434584811e-05
7526212982758575415,Why did you even let him sit there to begin with?? Poor baby 😭,0.0023584195878356695,2.8896276489831507e-05,0.00021296530030667782,9.547817899147049e-05,0.0005739787011407316,0.0001275239046663046,5.300380871631205e-05
7526212982758575415,Poor baby I feel so bad,0.011129363439977169,2.573905476310756e-05,0.0001633909996598959,0.0003986149386037141,0.002043185755610466,0.0003188835980836302,3.786115121329203e-05
7525447695784348983,Js do a hatch door ts would be goated,0.15834912657737732,0.0003025087062269449,0.001838478958234191,0.0007420795154757798,0.004005152266472578,0.12588757276535034,0.0009290697635151446
7525447695784348983,solution: hatch door,0.011498714797198772,0.00021215177548583597,0.0005283982609398663,0.0005729806143790483,0.0009026414481922984,0.017276844009757042,0.00019334918761160225
7525447695784348983,Never searching hatch door agian💔,0.0007234456134028733,2.325191417185124e-05,0.00015564139175694436,0.00017262586334254593,0.00018093852850142866,5.002827674616128e-05,2.518988912925124e-05
7525447695784348983,what is a hatch door is it like a dog door,0.11900678277015686,4.370718670543283e-05,0.001854620175436139,0.0005589466891251504,0.050037726759910583,0.00014747731620445848,9.995795699069276e-05
7525447695784348983,Hear me out just do a hatch door so it’s easy access,0.017760273069143295,0.0001299454306717962,0.00034787305048666894,0.0007488513947464526,0.0005803947569802403,0.011403756216168404,0.00015926444029901177
7525447695784348983,I searched up hatch door…… [photo],0.00041662610601633787,2.991427572851535e-05,0.00019722319848369807,9.84991856967099e-05,0.00018306820129510015,4.8540827265242115e-05,3.1599876820109785e-05
7525447695784348983,I would do a hatch door but I do hair and I feel like my clients would think I’m trying to kidnap them 😭,0.1391545832157135,0.00023891615273896605,0.0023149235639721155,0.0008420347003266215,0.004828685894608498,0.06287774443626404,0.001979958964511752
7525447695784348983,dont do a hatch door js add one at the bottom,0.009488451294600964,9.21775063034147e-05,0.0018060404108837247,0.0002311372518306598,0.0009290596353821456,0.0010330042568966746,0.00034536674502305686
7525447695784348983,How the HELL did u go up stairs that fast 😭😭,0.8136473894119263,0.0050418321043252945,0.5194803476333618,0.0024222766514867544,0.017074046656489372,0.005825311876833439,0.008530046790838242
7527647849748663574,alice stava diventando peppe brescia,0.02849910408258438,0.00027920480351895094,0.006825312040746212,0.0008577363914810121,0.019717037677764893,0.0005405041156336665,0.0008811526349745691
7527647849748663574,sinceramente la coppia Alice e Cristiano sarà sempre un passo in avanti,0.0014486754080280662,0.00011174350947840139,0.0004334731784183532,0.00111413246486336,0.0005012113251723349,0.00020663572649937123,0.0002108233456965536
7527647849748663574,ma quanto é alto cristiano???,0.02457357756793499,0.0002205165510531515,0.0009324703714810312,0.01391332596540451,0.0052430578507483006,0.00044768251245841384,0.0005992568330839276
7527647849748663574,Alice mentre sta pensando come uccidere Fabio [photo],0.3995717763900757,0.0010661229025572538,0.0016331402584910393,0.002658745739609003,0.001772121642716229,0.29693034291267395,0.003671643789857626
7527647849748663574,sta diventato una serie turca,0.0018008395563811064,0.004195741843432188,0.03943032771348953,0.007506405934691429,0.029109105467796326,0.0018408262403681874,0.0009945513447746634
7527647849748663574,"no però non vabene Alice e Cristiano,Viola e Cristiano😁",0.005897064693272114,9.644806414144114e-05,0.0004764441109728068,0.002638057339936495,0.0012812688946723938,0.00031000818125903606,0.00018754744087345898
7527647849748663574,La faccia di alice dopo che Fabio ha baciato @Viola Silvi [photo],0.004391106311231852,0.00014312032726593316,0.0020813101436942816,0.0001956814230652526,0.0010633082129061222,0.0004804071213584393,0.0010009983088821173
7527647849748663574,la differenza tra Alice e cristiano,0.004744542296975851,0.0003207107656635344,0.0010355962440371513,0.003739692037925124,0.0009657853515818715,0.0006211941945366561,0.0006386393797583878
7527647849748663574,adesso voglio un video cristiano e alice.,0.006671610288321972,0.0004061297804582864,0.001454907120205462,0.004639467224478722,0.001493900897912681,0.0007300457800738513,0.0008731745765544474
7527647849748663574,Ma alice silvi ne é consapevole di cosa sta facendo lollo?😅,0.046901486814022064,5.628852159134112e-05,0.0025374600663781166,0.00017930437752511352,0.044293828308582306,0.00022647604055237025,0.0002865211572498083
7524118947382168854,Never searching ulcinj spots again 💀,0.0025627324357628822,4.9877889978233725e-05,0.0006217805785126984,0.0002084932930301875,0.0008452140027657151,0.00013544430839829147,6.625577952945605e-05
7524118947382168854,ulcinj meaning 😭😭😭💀😳😳😳,0.0011796019971370697,4.937318226438947e-05,0.0005733854486607015,0.00017952763300854713,0.0004410493711475283,0.00010798734001582488,7.020142948022112e-05
7524118947382168854,"For those who do not understand and need further explanation, I would like to explain it as thoroughly as possible. Since I have taken the time to learn and seriously study the topic, I am sure that anyone who listens to this explanation will be able to understand it easily. I will try to use the language as easily as possible and try to avoid technical terms that may confuse it so that everyone can apply it and convey it correctly. First of all, you need to understand that everything in the world, both natural and artificial, always has a place to go, nothing happens irrationally, everything is logical and scientifically explainable, and as a person who has studied and reviewed this data for a long time, I am ready to explain this to you in the most detailed way. Explaining it scientifically requires the use of proven data and principles. The principles that I will explain are not just weightless words or stories that do not support it. I will try to illustrate and use scientific reasoning so that everyone can easily understand it and certainly apply it. I assure you, no one can explain it as easily as me. Whether it is for physics, chemistry, biology or even mathematics, I am ready to give you examples from everyday life. But in this case, to give you a short summary and a simpler scientific explanation, I have to say that it has the most obvious explanation, and the answer is, I don't know.",0.0003447268099989742,3.2645930332364514e-05,0.0001990453019971028,0.0001090751466108486,0.00023592000070493668,4.465427991817705e-05,2.8762442525476217e-05
7524118947382168854,ulcinj club,0.020516321063041687,0.00024322843819390982,0.004670257680118084,0.0006314889760687947,0.01905667968094349,0.0007395535358227789,0.00034839892759919167
7524118947382168854,qualche italiano che spiega?,0.0032138985116034746,0.00037852241075597703,0.007220465689897537,0.0020784232765436172,0.004609913565218449,0.0002934889344032854,0.00022734836966264993
7524118947382168854,Check my reposts,0.0011933514615520835,3.46580745826941e-05,0.00026467101997695863,0.0001667518081376329,0.0006361011764965951,5.679022069671191e-05,2.8268374080653302e-05
7524118947382168854,I have no fucking clue what I’m looking for,0.9237534403800964,0.028887731954455376,0.8568219542503357,0.005274720024317503,0.03098827786743641,0.008656490594148636,0.05963973328471184
7524118947382168854,wtf are we looking at chat ?🙏,0.5833955407142639,0.004204816650599241,0.3026536703109741,0.004229492507874966,0.007022354286164045,0.0024021295830607414,0.005915693938732147
7524118947382168854,whats ulcinj,0.00942376907914877,0.00010461339115863666,0.002548151183873415,0.0002815311308950186,0.0047572944313287735,0.00019528607663232833,0.00012782741396222264
7524118947382168854,Bro it’s dark we cannot see,0.006220431998372078,3.333331551402807e-05,0.00047020570491440594,0.0002504125004634261,0.002042436273768544,0.00015331455506384373,7.309435022762045e-05
7527392487661407511,T’ha guardato malissimo quella 😭,0.09757061302661896,0.0005289470427669585,0.07783553004264832,0.0006129511166363955,0.014113401062786579,0.0016395295970141888,0.0014123436994850636
7527392487661407511,AVETE FATTO I COMPITI DELLE VACANZE?🤓📚,0.0608476847410202,0.0011626507621258497,0.018057389184832573,0.0014171663206070662,0.029999101534485817,0.0012059422442689538,0.0012843760196119547
7527392487661407511,is this tuff in Italy 🥀🥀🥀,0.08360122889280319,0.0005047721788287163,0.024796368554234505,0.0013078368501737714,0.01720193214714527,0.0005918501992709935,0.0020412954036146402
7527392487661407511,"Para aquellos que no entienden y necesitan más explicaciones, quiero explicarlo lo más a fondo posible. Como me he tomado el tiempo de aprender y estudiar seriamente el tema, estoy seguro de que cualquiera que escuche esta explicación podrá entenderla fácilmente. Intentaré usar el lenguaje de la manera más simple posible y evitar términos técnicos que puedan confundirlos, para que todos puedan aplicarlo y transmitirlo correctamente.
En primer lugar, debe comprender que todo en el mundo, ya sea natural o artificial, siempre tiene un lugar, nada sucede irracionalmente y todo es explicable lógica y científicamente. Como alguien que ha estudiado y verificado estos datos durante mucho tiempo, estoy listo para explicárselo en detalle.
Para explicarlo científicamente, se deben usar datos y principios probados. Los principios que explicaré no son solo palabras ingrávidas o historias que no los apoyan. Intentaré ilustrar y aplicar argumentos científicos para que todos puedan entenderlos fácilmente y ciertamente aplicarlos.
"""" 'Te lo garantizo, nadie puede explicarlo tan simplemente como yo. Ya sea física, química, biología o incluso matemáticas, estoy dispuesto a darte ejemplos de la vida cotidiana. Pero en este caso, para darte un breve resumen y una explicación científica más simple, tengo que decir que hay la explicación más obvia, y la respuesta es: no lo sé.",0.0003920316812582314,0.0001526383130112663,0.0011382130905985832,0.00024988947552628815,0.0011646570637822151,0.00013108279381413013,7.991536404006183e-05
7527392487661407511,non ho capito hahahaha,0.001902773859910667,0.0011228732764720917,0.019136540591716766,0.0017270081443712115,0.010633266530930996,0.0006107643130235374,0.0003995813021901995
7527392487661407511,Se si alzava prima la tipa dovevi prendere un altro laurea,0.0014280825853347778,8.778539631748572e-05,0.000808016222435981,0.00017828795535024256,0.0006978697492741048,0.00039270048728212714,8.454989438178018e-05
7527392487661407511,"dois pacotes de pueblo para o médico, obrigado",0.0032048297580331564,0.0004849660617765039,0.005131780635565519,0.0007651872583664954,0.005735612008720636,0.0008219222072511911,0.00020212731033097953
7527392487661407511,cosa ho causato😭🙏🙏,0.032546110451221466,0.0008848010911606252,0.023646553978323936,0.0014301117043942213,0.004667383618652821,0.0009876893600448966,0.0005284768412820995
7527392487661407511,berti mi fa morire,0.2632947862148285,0.0015156420413404703,0.01237704511731863,0.001442433800548315,0.010693278163671494,0.028930701315402985,0.0015937316929921508
7527392487661407511,IO IL GIORNO DELLA MIA LAUREA,0.16130287945270538,0.0024510088842362165,0.02481973171234131,0.0027999840676784515,0.01920641027390957,0.002743279794231057,0.0033382470719516277
7527378888473758998,non ho capito ma sta con mar Lucas o con alice,0.030863061547279358,0.0014319568872451782,0.010660111904144287,0.0022282127756625414,0.008927262388169765,0.021422941237688065,0.001429857686161995
7527378888473758998,Sta diventando una serie turca,0.002091097179800272,0.0036575172562152147,0.03651018440723419,0.00787950586527586,0.026127411052584648,0.0018163404893130064,0.0008620769367553294
7527378888473758998,ma con chi sta con mar lucas o con alice mordenti,0.06110415980219841,0.00023078094818629324,0.004525786731392145,0.0010505489772185683,0.01663339138031006,0.004530203063040972,0.0008343306835740805
7527378888473758998,Io in realtà sto ancora aspettando Giulia bizzarri,0.015370175242424011,0.00014421172090806067,0.0037060377653688192,0.00031675081118009984,0.008327921852469444,0.001179705373942852,0.0009903766913339496
7527378888473758998,top rimasta in italia alice mordenti,0.2772352993488312,0.00025021895999088883,0.006076313089579344,0.004955426324158907,0.15654219686985016,0.000978965894319117,0.0003861545119434595
7527378888473758998,Nerf Alice Mordenti💀🙏,0.019857725128531456,0.00014835262845735997,0.001087014563381672,0.00044419593177735806,0.001395695609971881,0.011984609067440033,0.00034138941555283964
7527378888473758998,lo stavo aspettando io in primis🙄🤍,0.003082402516156435,0.0009610682027414441,0.011648898012936115,0.0015843607252463698,0.005160217639058828,0.0006456431001424789,0.00028238518279977143
7527378888473758998,vabbe io volevo giulia...,0.02535855583846569,0.0018445888999849558,0.021894363686442375,0.0018015826353803277,0.015542721375823021,0.0014013894833624363,0.0009887899504974484
7527378888473758998,ehh ma tanto la ship storica me e alice non si batteee 😁,0.001376225845888257,0.00011408235150156543,0.0016906695673242211,0.00025227066362276673,0.0009266346460208297,0.000151154599734582,0.00011279081809334457
7527378888473758998,FINALMENTE È ARRIVATA ALICEEE,0.0532388836145401,0.001409410499036312,0.017536237835884094,0.0027784137055277824,0.01700304076075554,0.0017232658574357629,0.0010581676615402102
7526165788969946390,ma si è fatta male 😂,0.01191752590239048,0.00023868662538006902,0.010197809897363186,0.000650340283755213,0.005027772393077612,0.0003054490953218192,0.0004052553267683834
7526165788969946390,quagliarella 😂,0.17026612162590027,0.00015477236593142152,0.005947690922766924,0.0005142858135513961,0.1541314572095871,0.0010642597917467356,0.0006892620003782213
7526165788969946390,Ma li conosci???,0.0025245477445423603,0.00011196301784366369,0.0026963648851960897,0.00020505968132056296,0.00151072780136019,0.00017665214545559138,0.00017077864322345704
7526165788969946390,ma con che mira ahahaaha,0.020040253177285194,0.0008161235600709915,0.017557593062520027,0.0010584964184090495,0.012516386806964874,0.0007705935277044773,0.000585380126722157
7526165788969946390,neanche se lo fa altre 1000 volte 😅,0.0010203991550952196,5.855847484781407e-05,0.0009346561855636537,0.00014100135012995452,0.0007865465013310313,7.856282900320366e-05,5.8611829444998875e-05
7526165788969946390,Come hanno reagito?,0.0004668783221859485,8.216176502173766e-05,0.0007357316208072007,0.0001558585063321516,0.0005349661223590374,0.00011625153274508193,6.389003829099238e-05
7526165788969946390,manco se fosse il tiro di Roberto carlos,0.013248655013740063,0.0004222425341140479,0.004596127662807703,0.0005821582744829357,0.0040643238462507725,0.005528095178306103,0.00064699980430305
7526165788969946390,Mi scusi signora😂😂,0.0009247299749404192,4.078249548911117e-05,0.0003649824939202517,0.00020178897830192,0.0006276865024119616,7.084529352141544e-05,9.179733751807362e-05
7526165788969946390,Cosa ti ha detto poi?🤣🤣🤣,0.0022566113620996475,0.00010238729737466201,0.002284269779920578,0.00018467992777004838,0.0015733151230961084,9.667126141721383e-05,0.00010696882964111865
7525904006972067094,That does not work,0.00044668372720479965,4.508688653004356e-05,0.0002926152665168047,0.0001299155701417476,0.00027498978306539357,7.5132840720471e-05,3.5603447031462565e-05
7525904006972067094,does it actually work😂,0.0003870128421112895,3.938575537176803e-05,0.0002837889187503606,0.0001257989788427949,0.00022566580446437,4.714868919108994e-05,3.8103109545772895e-05
7525904006972067094,We’ve had heat index at 103 lately We need chilled lines please,0.0006193508743308485,3.3170796086778864e-05,0.00017908209702000022,0.00012826465535908937,0.0001883247896330431,7.832816481823102e-05,3.8556059735128656e-05
7525904006972067094,more efficient if you twist the incoming and outgoing tube together to make counter current flows.,0.0008571472717449069,3.626404577516951e-05,0.00014928494056221098,0.0001913497399073094,0.00022257842647377402,0.00012184069055365399,3.285277489339933e-05
7525904006972067094,Too short tubes. I built mine with 10 kilometers long tubes.,0.0005883471458218992,5.576727198786102e-05,0.0003077454457525164,0.00014940810797270387,0.00023811768915038556,0.0001343104668194428,4.677099423133768e-05
7525904006972067094,"Tubing is too long, will lead to heat loss. Otherwise... why not? did it work?",0.0007641026750206947,3.00549636449432e-05,0.0001730084914015606,0.00010952341108350083,0.0002097866527037695,0.00012688757851719856,3.9010901673464105e-05
7525904006972067094,Where’s the pump,0.0007207775488495827,2.2126174371805973e-05,0.00014316591841634363,9.707004210213199e-05,0.00023954545031301677,5.601302473223768e-05,2.6942720069200732e-05
7525904006972067094,Why so far away?,0.0005371335428208113,2.534492341510486e-05,0.00015788304153829813,0.00010401754843769595,0.0002137065166607499,4.392421033116989e-05,2.5464047212153673e-05
7525904006972067094,How does it workksss????,0.0020472723990678787,4.912150325253606e-05,0.0009740155655890703,0.00022837512369733304,0.0005993870436213911,6.91970853949897e-05,7.379211456282064e-05
7526324072964312342,non x essere offensiva ma quel tatuaggio che hai sulla schiena è fine line…🫨,0.035404689610004425,0.0019189552403986454,0.032619960606098175,0.0018693107413128018,0.01871822401881218,0.005905722267925739,0.004708441905677319
7526324072964312342,Fine Line vs watercolor è tipo chihuahua contro pinscher,0.004613792523741722,7.262404687935486e-05,0.0010594638297334313,0.00021139196178410202,0.003928167279809713,0.00020237262651789933,0.00011066276783822104
7526324072964312342,mora con i tatuaggi fineline 💔,0.01598825491964817,0.00190502661280334,0.023268375545740128,0.0031712325289845467,0.018169691786170006,0.001666200696490705,0.0009379354887641966
