video_id,comment,toxicity,severe_toxicity,obscene,identity_attack,insult,threat,sexual_explicit
7525775639949937943,non ha insultato tua madre....,0.07459019869565964,0.00016984228568617254,0.0021310709416866302,0.000981121906079352,0.010916496627032757,0.0011877866927534342,0.0038721193559467793
7525775639949937943,Classico infame napoletame,0.008690491318702698,0.00041263975435867906,0.007510058581829071,0.0007910312269814312,0.012524021789431572,0.00036025710869580507,0.00035879749339073896
7525775639949937943,Indovina la tribù,0.006309570278972387,0.0003937027940992266,0.004171573091298342,0.0008895081700757146,0.004538916517049074,0.0016988040879368782,0.0003290089953225106
7525775639949937943,"ma poi ""Adda muri mammà"" in italiano vuol dire ""ti giuro a mia madre"" o sbaglio?",0.04757988452911377,0.00030029553454369307,0.007938512600958347,0.0016429987736046314,0.009325343184173107,0.003527383552864194,0.0019775857217609882
7525775639949937943,Indovina la città 😂😂,0.0007782765896990895,2.5738687327248044e-05,0.0002514554071240127,0.00012837257236242294,0.00041590785258449614,3.8182115531526506e-05,2.4267565095215105e-05
7525775639949937943,indovina la provenienza,0.0013008229434490204,0.0038529066368937492,0.029336879029870033,0.005498150829225779,0.026846792548894882,0.00208431133069098,0.0008021432440727949
7525775639949937943,In realtà non ha insultato tua madre…,0.02897413820028305,9.035816765390337e-05,0.0014057229273021221,0.0005503285792656243,0.006558881141245365,0.00041187636088579893,0.002112940652295947
7525775639949937943,A Napoli ovviamente 🤣,0.0004259365377947688,3.363853465998545e-05,0.00018996739527210593,0.00015678489580750465,0.0002467044978402555,4.976215859642252e-05,2.629189293656964e-05
7525775639949937943,Africa,0.0039056818932294846,0.00013197690714150667,0.0006246459088288248,0.003932710736989975,0.0006344806170091033,0.00014367794210556895,0.00011249907402088866
7525775639949937943,"non giustifico il suo comportamento, ma da napoletano ho capito cos’ha detto e non ce l’aveva con tua mamma ahahaha",0.1320992261171341,0.0003927935322280973,0.012185211293399334,0.002974261762574315,0.04425698146224022,0.0004001244669780135,0.001677247229963541
7524834361464851735,ma quanto è felice l'amica🥹🥹,0.004180331714451313,0.0013612332986667752,0.019219323992729187,0.0031136716715991497,0.011859724298119545,0.0007114211330190301,0.0010538347996771336
7524834361464851735,ma perché è senza scarpe lui?😭,0.006446269806474447,3.322598058730364e-05,0.0005977342952974141,0.00010245283192489296,0.0038261497393250465,0.00014923824346624315,0.00014907469449099153
7524834361464851735,Esiste ancora la baia imperiale?,0.000584788154810667,6.147788371890783e-05,0.0006551013793796301,0.00012416887329891324,0.0005553753580898046,8.235394489020109e-05,7.926848047645763e-05
7524834361464851735,E tu sei rimasta senza malessere??😂,0.007742004469037056,7.241885759867728e-05,0.0014901671092957258,0.0003113442799076438,0.004883859772235155,0.00011237504077143967,8.470209286315367e-05
7524834361464851735,Scusate…ma quella è cattolica….e un po’ lontano da riccione….non è che se siete in Romagna siete x forza a riccione,0.045140769332647324,0.0002348067209823057,0.002190167084336281,0.015515566803514957,0.009314323775470257,0.0007831716211512685,0.0008698421879671514
7524834361464851735,saró strana io ma non so come facciate a darvi baci e passare momenti cosi belli con dei sconosciuti e “far finta di niente” dopo🥹,0.2990381419658661,0.0020250240340828896,0.07345527410507202,0.0041934116743505,0.014985889196395874,0.001203132444061339,0.04140152782201767
7524834361464851735,Potete commentare negativamente così da non normalizzare il malessere?,0.0010273295920342207,4.154619455221109e-05,0.0003131252888124436,0.0001862550707301125,0.0006401085993275046,6.50284782750532e-05,3.5838191251968965e-05
7524834361464851735,mai uscire con un lord come questo. Mamma santa che schifo.,0.9726418256759644,0.002081444952636957,0.33269041776657104,0.00396402832120657,0.7436212301254272,0.0025925571098923683,0.003626299789175391
7524834361464851735,@🎀 probabilmente tu con qualsiasi malessere 😭😭😭,0.010030096396803856,8.272419654531404e-05,0.0013232114724814892,0.0003430732467677444,0.0049050357192754745,0.00015244893438648432,6.362907151924446e-05
7524834361464851735,Conosciuto a Rimini sposati da 18 anni 🤣,0.0008519332623109221,0.00017384887905791402,0.002193690976127982,0.0002576711121946573,0.0013159258523955941,0.000123367048217915,0.00025226440629921854
7523695760970403094,tiktok premium,0.0066260118037462234,0.00037795957177877426,0.005586342420428991,0.0008171078516170382,0.007399874739348888,0.001059305970557034,0.00031050777761265635
7523695760970403094,Da riconoscere che ha talento,0.0013805064372718334,0.00035679881693795323,0.004060889594256878,0.0003281031094957143,0.0028923163190484047,0.0005849445005878806,0.00043482132605277
7523695760970403094,Il mio gatto lo fa da sempre 😂,0.004508979618549347,3.921822280972265e-05,0.0008409169968217611,0.00019371657981537282,0.003492221236228943,5.123301889398135e-05,0.0001321127638220787
7523695760970403094,mi immagino la gente che abita davanti a lui e lo vede provare sta cosa da solo,0.0019245498115196824,0.00013833135017193854,0.0026549426838755608,0.0002000668755499646,0.0012059222208335996,0.00021729731815867126,0.00017337145982310176
7523695760970403094,Somigli a Marc Marquez ora mi spiego tante cose 😁,0.0030781913083046675,0.00045147264609113336,0.007645096629858017,0.0009863239247351885,0.0056139398366212845,0.0005705059738829732,0.0002863365807570517
7523695760970403094,Mi sa che è il nome hahahah😂,0.0007886254461482167,8.788340346654877e-05,0.001321503659710288,0.00019881314074154943,0.000818864325992763,7.917261245893314e-05,7.692719373153523e-05
7523695760970403094,Ma se non studio diventô così?,0.0006620674394071102,0.00014091211778577417,0.001619446207769215,0.00024164552451111376,0.0013002970954403281,0.00015515492123086005,8.977833203971386e-05
7523695760970403094,E così esaurito…. Lo voglio come amico haha,0.0035772707778960466,0.00021039701823610812,0.0024913279339671135,0.00032397345057688653,0.00237682880833745,0.0003444120811764151,0.0004992294707335532
7523695760970403094,"Io voglio sapere come lo ha imparato, cioè il momento esatto in cui lui DA SOLO si è messo a provare sta cosa 😭",0.0016077085165306926,0.0001387759402859956,0.002907808870077133,0.0001374350831611082,0.0010189255699515343,0.00017890868184622377,0.000254201702773571
7523695760970403094,quindi...non cresceranno mai?,0.0038773096166551113,0.0002177137357648462,0.001628706231713295,0.0002696413139346987,0.001177180907689035,0.0019669439643621445,0.0003999475156888366
7525592369954295042,a Camden town se ti sentono parlare italiano iniziano automaticamente a provarci 💀,0.009457060135900974,0.0005173755344003439,0.008564782328903675,0.0023178085684776306,0.004385618958622217,0.0008644512854516506,0.0004889325355179608
7525592369954295042,"Dovevi ricordargli anche la parte dove dice ""Alziamo la coppa a Wembley""🇮🇹",0.001231460366398096,6.495862908195704e-05,0.0008855829364620149,0.00014459369413089007,0.0007608775631524622,0.00011784174421336502,9.86846789601259e-05
7525592369954295042,"""ALZIAMO LA COPPA A WEMBLEY""",0.4837343096733093,0.0046991100534796715,0.08127399533987045,0.0018294506007805467,0.07963027060031891,0.035189129412174225,0.0628044456243515
7525592369954295042,AVETE FATTO I COMPITI DELLE VACANZE?😊📚,0.030160771682858467,0.0002885725989472121,0.008337071165442467,0.0005226682987995446,0.018933627754449844,0.0006413552910089493,0.0006142301135696471
7525592369954295042,"this is off topic, don't hate me, but bordiga fought for you.
he struggled for the dictatorship of the proletariat ✊. and he despised opportunism 🚫.
he defeated reformism ⚔️, and gave us the invariant program 📜. HE IS THE PARTY ☭.
return to the principles before it's too late ⏳!
COMMUNISM IS NOT A PLACE IF CAPITALIST RELATIONS AREN'T ABOLISHED ⚒️.",0.028335630893707275,6.896513514220715e-05,0.0011807925766333938,0.0008053128840401769,0.0022424731869250536,0.00010998558718711138,9.205267997458577e-05
7525592369954295042,capo plaza ringrazia,0.0010431499686092138,0.0002876721555367112,0.0027074224781244993,0.0006491594249382615,0.002362871076911688,0.0002715193841140717,0.00019073676958214492
7525592369954295042,@Simmy🤍⁷ ricordi a camden town?😂😂,0.0006312283803708851,2.0978955944883637e-05,0.0001658810069784522,0.00010671310883481055,0.00031395239057019353,2.846511961251963e-05,1.972182326426264e-05
7525592369954295042,"eravamo a camden town,siamo entrati in un negozio di souvenir e hanno messo anna pepe🥀🥀",0.001565070473589003,0.0002778256020974368,0.004606376867741346,0.000579513143748045,0.0021259370259940624,0.00018366491713095456,0.00021951676171738654
7525592369954295042,menomale tra poco ci devo andare,0.5313268899917603,0.0030992666725069284,0.12458688020706177,0.004556472413241863,0.08848433196544647,0.005454476922750473,0.01445305347442627
7524690589091138838,THE GIRL FROM SUBWAY SURFER ????,0.04724800959229469,0.00026370404521003366,0.003983887378126383,0.00268490519374609,0.007734019309282303,0.00040528352838009596,0.003074194537475705
7524690589091138838,Raga ma perché la barra di ricerca è: jenni serpi🪚🪚🪚 costume,0.07915469259023666,0.0023773342836648226,0.02701561339199543,0.0059180776588618755,0.041332438588142395,0.003086716402322054,0.002724240068346262
7524690589091138838,Jenny serpi 🪚🪚🪚costume,0.08780378848314285,0.0005047649028711021,0.014199299737811089,0.003970094956457615,0.04519033804535866,0.0013098083436489105,0.006658897269517183
7524690589091138838,AVETE FATTO I COMPITI DELLE VACANZE?😞📚,0.14906057715415955,0.002139581134542823,0.029014766216278076,0.0034395859111100435,0.03945000097155571,0.0013994616456329823,0.002163182245567441
7524690589091138838,ma io nn ho capito se è sorda e per capire le persone legge il labiale come capisce la melodia e le parole delle canzoni,0.025775767862796783,0.00044302729656919837,0.009474103339016438,0.0006546235526911914,0.01938985101878643,0.0005649530212394893,0.003615157911553979
7524690589091138838,"ma aiuto ""Jenny serpi 🪚🪚🪚🪚🪚 costume""",0.024220583960413933,0.0004406243097037077,0.012542475014925003,0.0014078543754294515,0.011850775219500065,0.0009765825234353542,0.002579321153461933
7524690589091138838,ma perché nella ricerca c’è scritto “jenni serpi 🪚 🪚 🪚 costume” ?,0.07395020872354507,0.0011656665010377765,0.031005041673779488,0.00846077874302864,0.029054349288344383,0.0015050051733851433,0.004735602531582117
7524690589091138838,With the cross ?!?!?,0.0007618904928676784,2.4087285055429675e-05,0.00024380844843108207,6.935530109331012e-05,0.00022392177197616547,7.954137254273519e-05,5.8628767874324694e-05
7524690589091138838,Temu final boss🙄,0.0023859606590121984,4.153315967414528e-05,0.0005471255863085389,0.00012323771079536527,0.001344942837022245,0.00022043792705517262,8.335252641700208e-05
7525499368191855894,Quanto c’ha in banca ?,0.0006661878433078527,2.5538538466207683e-05,0.0002468534221407026,9.317880176240578e-05,0.0003361798299010843,4.91646678710822e-05,2.9129572794772685e-05
7525499368191855894,"Le relazioni con così tanta differenza di età mi ricordano quando alle superiori ci spiegarono la coscienza e il taglio netto con la parte paterna. Che sognavi di uccidere la madre perché avevi un rapporto d’attaccamento più forte verso tuo padre. (Non sto insultando, ognuno è libero di stare con chi vuole basta essere felici)",0.1488671600818634,0.00015693806926719844,0.000623213651124388,0.0008588383789174259,0.00526932580396533,0.04281402379274368,0.0018277934286743402
7525499368191855894,"i problemi sorgeranno tra qualche anno. Lui comincerà presto ad invecchiare mentre tu sarai ancora nel pieno degli anni, con tutto quello che ne consegue",0.0025993487797677517,7.155194180086255e-05,0.0015820317203179002,0.000122825222206302,0.0014845315599814057,0.00010642633424140513,0.00013764518371317536
7525499368191855894,"Ho un figlio di 10 con una donna 18 anni più giovane di me ed in questi 11 anni abbiamo visto lasciarsi almeno 30 coppie ""più giuste"" in sintonia con l'età e con i figli che manco si salutano e si sono fatti le peggio cose ! la verità è che se c'è dialogo e ci si vuole davvero bene non conta nulla perché l'unica cosa che conta davvero è la salute quindi fare programmi spesso si rivela inutile e poi la società di oggi rende più difficile stare insieme ad altri",0.005500310100615025,3.425290560699068e-05,0.0004347243229858577,0.00019703805446624756,0.0028698521200567484,5.379970389185473e-05,0.0001918367634061724
7525499368191855894,Bello il conto in banca eh 🥰🥰🥰,0.0010848711244761944,0.003957665991038084,0.030192149803042412,0.005493040196597576,0.025898071005940437,0.0019913825672119856,0.0007807851652614772
7525499368191855894,32 anni di differenza 28 anni che stiamo insieme 25 anni di matrimonio 2 figlie e siamo ancora felici 🥰 andate oltre la differenza di età e il conto in banca,0.0004227667232044041,0.0011034627677872777,0.007719903718680143,0.0008294508443213999,0.004513240419328213,0.0004859845794271678,0.0012800313998013735
7525499368191855894,perché pensate alle solite cazzate? nel 2025 ancora avete pregiudizi svegliati.,0.8761910796165466,0.0018372595077380538,0.603305459022522,0.0014129059854894876,0.3150133490562439,0.0007179856183938682,0.004439833108335733
7525499368191855894,Soldi.. Ripeti con me... Soldiiii,0.051996227353811264,0.0003242181846871972,0.0034248987212777138,0.00042567047057673335,0.004514384549111128,0.03451349586248398,0.0014112176140770316
7525499368191855894,pensavo fosse il padre😂🙈,0.0008567443583160639,0.00015300858649425209,0.0010655157966539264,0.00031442235922440886,0.0010017342865467072,0.00016877661983016878,0.00013881245104130358
7525499368191855894,Forse sono single perché la mia lei deve ancora nascere (ho quasi 25 anni) 🤔,0.0019835501443594694,0.00011275931319687515,0.0018263618694618344,0.00026414540479891,0.001379413646645844,0.0002110268542310223,0.0004025692760478705
7523989465484856598,Vittorio sei caduto?,0.01434799749404192,0.00010869750985875726,0.0030951134394854307,0.0003051114617846906,0.005070675164461136,0.0009498870931565762,0.0005617030547000468
7523989465484856598,Antonio sei caduto? sei caduto?,0.02823261357843876,0.00014381349319592118,0.003986978437751532,0.0003207065165042877,0.00974748469889164,0.00040519487811252475,0.0001820314791984856
7523989465484856598,la bottiglia in acqua🤦🏻‍♀️,0.0013059673365205526,0.0002484874858055264,0.0031407601200044155,0.0003239379439037293,0.0011730706319212914,0.0003082751645706594,0.00032695839763619006
7523989465484856598,la bottiglia buttata però in acqua non va bene,0.02167917601764202,0.0003759778046514839,0.005230031907558441,0.00044505123514682055,0.003669138066470623,0.006570981349796057,0.0019139450741931796
7523989465484856598,alle 04:04 non sapete quanto fa ridere,0.11389397084712982,0.0046132709830999374,0.04102443903684616,0.010157045908272266,0.03001094050705433,0.0021629249677062035,0.0015263828681781888
7523989465484856598,AVETE FATTO I COMPITI DELLE VACANZE?😞📚,0.14906029403209686,0.0021395820658653975,0.02901475876569748,0.0034395873080939054,0.03945000097155571,0.0013994622277095914,0.0021631831768900156
7523989465484856598,la caduta non era prevista 😭,0.0011690780520439148,0.00012507235805969685,0.0018049980280920863,0.00027451434289105237,0.0010586647549644113,0.00019101248471997678,0.00010302222653990611
7523989465484856598,ANCHE IO CI SONO ANDATA A TROPEA AHHAAHAH,0.6226469278335571,0.006359224673360586,0.04816010966897011,0.005717256106436253,0.033157169818878174,0.002663961611688137,0.006370336748659611
7523989465484856598,si carut ? Antonio sei caduto ? sei caduto Antonio ?,0.02356012724339962,0.00016199373931158334,0.005379271227866411,0.0005120286950841546,0.009527892805635929,0.00030374794732779264,0.00020727467199321836
7523989465484856598,@user11111666611__ tropea,0.0018392062047496438,0.00019099810742773116,0.0020220926962792873,0.0003549047978594899,0.0024990017991513014,0.00011455589265096933,6.966439104871824e-05
7524046080091213078,ma anche giulia è al mare😁😁🥰🥺 giuliabizzarri,0.0010340085718780756,0.0005512906354852021,0.007852385751903057,0.0011931231711059809,0.005510570481419563,0.0003315958601888269,0.00024359235248994082
7524046080091213078,the best duo 💕,0.0005096226232126355,8.993239316623658e-05,0.0008677568985149264,0.0001903864467749372,0.0006635171012021601,0.00010767269850475714,6.856316758785397e-05
7524046080091213078,"Ciao Cri mi chiamo Ester e ho 13 anni e tra poco la mia amica Matilde compie appunto 13 anni è ossessionata da voi soprattutto da TE e vi nomina sempre e come regalo le farebbe un sacco piacere anzi morirebbe per avere un vostro video saluto o dove le fate gli auguri…detto questo mi piacerebbe molto che voi leggeste questo commento perchè ci tengo davvero molto anche io a farle questo regalo e siete per lei un bel punto di riferimento,grazie per strapparci sempre un sorriso e per questa canzone che davvero SPACCA…se volete questo è il profilo instagram di mia mamma per mandare il video se deciderete di farlo: ilaria_mangani…grazie mille vi auguro il meglio FORZA BREAKFAST CLUB💕💕💕 e ragazzi so che sembra una cosa forse stupida ma siccome ci tengo tanto potreste taggare fabio viola e cristiano?…fareste molto contributo grazie mille❤️",0.055113233625888824,0.00019792700186371803,0.0017955312505364418,0.0013912009308114648,0.03972917050123215,0.00023932880139909685,0.00047074409667402506
7524046080091213078,30 years in dagestan,0.0005950258346274495,2.539125307521317e-05,0.00013843283522874117,0.00016326984041370451,0.00028289423789829016,4.113222166779451e-05,2.3484726625611074e-05
7524046080091213078,Are you a couple ?,0.010481452569365501,2.540428249631077e-05,0.0005146418116055429,9.135859727393836e-05,0.006674141623079777,4.2635634599719197e-05,7.020772318355739e-05
7524046080091213078,Come to Dagestan [photo],0.0004912695148959756,8.32934892969206e-05,0.0006232460145838559,0.0003353757201693952,0.000565327936783433,7.481119246222079e-05,4.8610076191835105e-05
7524046080091213078,Ciao o sfiga per 10 anni,0.9107322096824646,0.007402712479233742,0.10888541489839554,0.017708050087094307,0.13198186457157135,0.004369740840047598,0.23272082209587097
7524046080091213078,10 years Dagestan,0.0005439516389742494,0.0006981914048083127,0.006169912870973349,0.0011240012245252728,0.005037227179855108,0.0005002202233299613,0.00020306266378611326
7524046080091213078,quasi scappava il bacio,0.3643456697463989,0.0022088070400059223,0.02937597781419754,0.0010121000232174993,0.006615655962377787,0.046166785061359406,0.11789263784885406
7524020027301907734,"why only 2,40m is tunnel ahead?",0.0004966003471054137,3.417971674934961e-05,0.00021288247080519795,0.0001040510687744245,0.0002511903876438737,8.059073297772557e-05,3.163962173857726e-05
7524020027301907734,i ciclisti sono pericolosi anche in auto...,0.024140125140547752,2.5644847482908517e-05,0.000538631051313132,0.0013504589442163706,0.01051207073032856,0.00010315847612218931,0.00011048551823478192
7524020027301907734,uscita autistrada bressanone direzione val pusteria?,0.0013912055874243379,0.0003996841551270336,0.006203817203640938,0.0007224865257740021,0.004436447285115719,0.0003360504051670432,0.00030108445207588375
7524020027301907734,"That's not an accident. It is a masterpiece! 😅😅😅
If a banana taped to a canvas worth millions, what is the value of this art?",0.0007760311709716916,1.968910510186106e-05,0.00021525847841985524,6.982581544434652e-05,0.00030196065199561417,3.447482959018089e-05,3.084870331804268e-05
7524020027301907734,"Scusate ragazzi, errore mio: erano le scarpe che si lasciavano appese, non il portapacchi e la bici. Mi confondo sempre, scusate.",0.0007344041368924081,0.00023343235079664737,0.002949300454929471,0.0002547160256654024,0.001579167670570314,0.0001990786986425519,0.0003076840948779136
7524020027301907734,Tehnologia 🤣👌,0.0005437909276224673,2.970077002828475e-05,0.00021964572079014033,0.000128825064166449,0.00028856683638878167,4.495019311434589e-05,2.632993164297659e-05
7524020027301907734,Scommettiamo che anche qui è colpa dei camionisti ????,0.0011258668964728713,2.65635007963283e-05,0.000414051377447322,9.30431269807741e-05,0.00043692209874279797,4.802792682312429e-05,5.834420881001279e-05
7524020027301907734,It took me a second to understand 🤣🤣🤣,0.0006259405636228621,3.0676586902700365e-05,0.00027198781026527286,0.00010994301555911079,0.00037700124084949493,3.534863208187744e-05,2.3952501578605734e-05
7524020027301907734,Opera d'arte.,0.0007806245121173561,5.093629442853853e-05,0.0006115783471614122,0.0001075480249710381,0.0005413195467554033,8.65707770572044e-05,6.340641266433522e-05
7524020027301907734,karma 😂😂😂,0.0005814784090034664,2.1191393898334354e-05,0.00014119132538326085,0.00014313083374872804,0.0002726420934777707,3.778648533625528e-05,2.1463545635924675e-05
7521701259653434646,si chiama reverse diet. la fanno fare i nutrizionisti dopo lo stallo del peso. evidentemente tu stavi mangiando troppo poco e mangiando di più hai fatto inconsapevolmente la reverse diet 😄,0.0017002108506858349,1.5252692719514016e-05,0.0002179343136958778,7.879233453422785e-05,0.0008509543840773404,2.9135406293789856e-05,2.908258102252148e-05
7521701259653434646,Vorrei avere sto problema 😂,0.009888581931591034,0.00021408687462098897,0.00888717919588089,0.00043622212251648307,0.0030858535319566727,0.00038756555295549333,0.0003207214758731425
7521701259653434646,"Normopeso (1,60 per 52 kg), a causa di un problema di salute scendo in grave sottopeso perdendo 12 kg in due mesi e arrivando a 40kg di botto, con tutti i danni che ne sono conseguiti.. due mesi per perdere 12kg, due anni e mezzo per riprenderne 8 tra palestra e alimentazione.. 💀 ti capisco, ingrassare e soprattutto farlo bene è davvero complicato 😭😭",0.0030026095919311047,7.251125498441979e-05,0.001781691680662334,7.019995973678306e-05,0.0012324309209361672,0.0001270701759494841,0.0003751811455003917
7521701259653434646,ma chi scrive reverse diet😅 è metabolismo veloce anche io mangio per 3 e peso 60kg ma credetemi non è una fortuna si posso mangiare qualunque in qualsiasi quantità e non prendo un kg.. ma se non mangio tanto mi sento male arrivo per terra. gente come me non sta una giornata all impiedi con solo 1 piatto di pasta.. il grasso è riserva di energia.. senza grasso il corpo non ha energia,0.002971651265397668,3.016045047843363e-05,0.00047119683586061,0.00013204626156948507,0.0010721413418650627,8.423307008342817e-05,7.144925621105358e-05
7521701259653434646,"Significa che prima il tuo corpo era in riserva, mangiavi troppo poco 🤭",0.02954147569835186,8.191978849936277e-05,0.0009057265124283731,0.0005118425469845533,0.005420081317424774,0.002951565897092223,0.0009407278266735375
7521701259653434646,Vorrei non avere sto problema.. vorrei essere grassottella 😭,0.5056092143058777,0.001720692845992744,0.1570652425289154,0.0017855383921414614,0.24717792868614197,0.007179039530456066,0.01576126553118229
7521701259653434646,beh questa è fortuna ad avere un corpo che invece di ingrassare... dimagrisce!! Pensa a chi invece è dieta tutto l'anno e ingrassa solo con l'aria 😳,0.02116668038070202,0.00011307188106002286,0.004652596544474363,0.0001279575371881947,0.005484307184815407,0.0005607709172181785,0.0022288307081907988
7521701259653434646,no raga non potete capire che paranoia in estate...si vedono tutte le ossa...pagherei per ingrassare...ma proprio non riesco...ultimo scoglio a settembre dalla nutrizionista...speriamo bene,0.0007421300979331136,4.444415753823705e-05,0.00040087354136630893,0.00013353812391869724,0.0005267182714305818,7.187938899733126e-05,6.142121856100857e-05
7521701259653434646,tutti i video con ste canzoni sembrano pubblicità,0.02393406443297863,0.00043104845099151134,0.012388626113533974,0.0008769265841692686,0.008726687170565128,0.0003598184266593307,0.000965684128459543
7521701259653434646,reverse diet,0.0005174262914806604,0.00013061029312666506,0.001008898951113224,0.00025317471590824425,0.0007732555968686938,0.00019130486180074513,0.00011462167458375916
7519917205090323734,Dove hai preso il vesititoo?,0.018837690353393555,0.0003095943829976022,0.00878159049898386,0.0005401750095188618,0.007361541502177715,0.0008071393240243196,0.001760742045007646
7519917205090323734,Giada sei una bella Donna matura ti invio il mio numero di telefono cellulare +393479892207 Ciro Ottaiano di Sant'Anastasia napoli 80O48 Campania Italia ❤️❤️,0.007581014651805162,0.0010742760496214032,0.014996163547039032,0.0012015273096039891,0.0048848772421479225,0.0006654238677583635,0.0032792030833661556
7519917205090323734,"Great dress babe, may I know where did you get that?",0.00043058788287453353,2.2267109670792706e-05,0.0001338808360742405,9.380017581861466e-05,0.00014260744501370937,3.137060411972925e-05,3.766359077417292e-05
7519917205090323734,Dress from??,0.00045707711251452565,2.1774509150418453e-05,0.00013986567500978708,8.364960376638919e-05,0.00019755141693167388,4.541769885690883e-05,2.8859263693448156e-05
7519917205090323734,no man deserves this,0.04945182427763939,0.0004252827202435583,0.0015276683261618018,0.005477601196616888,0.023047644644975662,0.002308676717802882,0.001170910312794149
