video_id,comment,toxicity,severe_toxicity,obscene,identity_attack,insult,threat,sexual_explicit
7504667813332716822,trova l’intruso 🍭🍭🍭🍭🍭🍭🍭🍭🍭🍭🍭🍭🍭🍭🍭🍭🍭🍭🍭🍭🍭🍭🍭🍭🍭🍭🍭🍭🍭🍭🍭🍭🍭🍭🍭🍭🍭🍭🍭🍭🍭🍭🍭🍭🍭🍭🍭🍭🍭🍭🍭🍭🍭🍭🍭🍭🍭🍭🍭🍭🍭🍭🍭🍭🍭🍭🍭🍭🍭🍭🍭🍭🍭🍭🍭🍭🍭🍭🍭🍭🍭🍭🍭🍭🍭🍭🍭🍭🍭🍭🍭🍭🍭🍭🍭🍭🍭🍭🍭🍭🍭🍭🍭🍭🍭🍭🍭🍭🍭🍭🍭🍭🍭🍭🍭🍭🍭🍭🍭🍭🍭🍭🍭🍭🍭🍭🍭🍭🍭🍭🍭🍭🍭🍭🍭🍭🍭🍭🍭🍭🍭🍭🍭🍭🍭🍭🍭🍭🍭🍭🍭🍭🍭🍭🍭🍭🍭🍭🍭🍭🍭🍭🍭🍭🍭🍭🍭🍭🍭🍭🍭🍭🍭🍭🍭🍭🍭🍭🍭🍭🍭🍭🍭🍭🍭🍭🍭🍭🍭🍭🍭🍭🍭🍭🍭🍭🍭🍭🍭🍭🍭🍭🍭🍭🍭🍭🍭🍭🍭🍭🍭🍭🍭🍭🍭🍭🍭🍭🍭🍭🍭🍭🍭🍭🍭🍭🍭🍭🍭🍭🍭🍭🍭🍭🍭🍭🍭🍭🍭🍭🍭🍭🍭🍭🍭🍭🍭🍭🍭🍭🍭🍭🍭🍭🍭🍭🍭🍭🍭🍭🍭🍭🍭🍭🍭🍭🍭🍭🍭🍭🍭🍭🍭🍭🍭🍭🍭🍭🍭🍭🍭🍭🍭🍭🍭🍭🍭🍭🍭🍭🍭🍭🍭🍭🍭🍭🍭🍭🍭🍭🍭🍭🍭🍭🍭🍭🍭🍭🍭🍭🍭🍭🍭🍭🍭🍭🍭🍭🍭🍭🍭🍭🍭🍭🍭🍭🍭🍭🍭🍭🍭🍭🍭🍭🍭🍭🍭🍭🍭🍭🍭🍭🍭🍭🍭🍭🍭🍭🍭🍭🍭🍭🍭🍭🍭🍭🍭🍭🍭🍭🍭🍭🍭🍭🍭🍭🍭🍭🍭🍭🍭🍭🍭🍭🍭🍭🍭🍭🍭🍭🍭🍭🍭🍭🍭🍭🍭🍭🍭🍭🍭🍭🍭🍭🍭🍭🍭🍭🍭🍭🍭🍭🍭🍭🍭🍭🍭🍭🍭🍭🍭🍭🍭🍭🍭🍭🍭🍭🍭🍭🍭🍭🍭🍭🍭🍭🍭🍭🍭🍭🍭🍭🍭🍭🍭🍭🍭🍭🍭🍭🍭🍭🍭🍭🍭🍭🍭🍭🍭🍭🍭🍭🍭🍭🍭🍭🍭🍭🍭🍭🍭🍭🍭🍭🍭🍭🍭🍭🍭🍭🍭🍭🍭🍭🍭🍭🍭🍭🍭🍭🍭🍭🍭🍭🍭🍭🍭🍭🍭🍭🍭🍭🍭🍭🍭🍭🍭🍭🍭🍭🍭🍭🍭🍭🍭🍭🍭🍭🍭🍭🍭🍭🍭🍭🍭🍭🍭🍭🍭🍭🍭🍭🍭🍭🍭🍭🍭🍭🍭🍭🍭🍭🍭🍭🍭🍭🍭🍭🍭🍭🍭🍭🍭🍭🍭🍭🍭🍭🍭🍭🍭🍭🍭🍭🍭🍭🍭🍭🍭🍭🍭🍭🍭🍭🍭🍭🍭🍭🍭🍭🍭🍭🍭🍭🍭🍭🍭🍭🍭🍭🍭🍭🍭🍭🍭🍭🍭🍭🍭🍭🍭🍭🍭🍭🍭🍭🍭🍭🍭🍭🍭🍭🍭🍭🍭🍭🍭🍭🍭🍭🍭🍭🍭🍭🍭🍭🍭🍭🍭🍭🍭🍭🍭🍭🍭🍭🍭🍭🍭🍭🍭🍭🍭🍭🍭🍭🍭🍭🍭🍭🍭🍭🍭🍭🍭🍭🍭🍭🍭🍭🍭🍭🍭🍭🍭🍭🍭🍭🍭🍭🍭🍭🍭🍭🍭🍭🍭🍭🍭🍭🍭🍭🍭🍭🍭🍭🍭🍭🍭🍭🍭🍭🍭🍭🍭🍭🍭🍭🍭🍭🍭🍭🍭🍭🍭🍭🍭🍭🍭🍭🍭🍭🍭🍭🍭🍭🍭🍭🍭🍭🍭🍭🍭🍭🍭🍭🍭🍭🍭🍭🍭🍭🍭🍭🍭🍭🍭🍭🍭🍭🍭🍭🍭🍭🍭🍭🍭🍭🍭🍭🍭🍭🍭🍭🍭🍭🍭🍭🍭🍭🍭🍭🍭🍭🍭🍭🍭🍭🍭🍭🍭🍭🍭🍭🍭🍭🍭🍭🍭🍭🍭🍭🍭🍭🍭🍭🍭🍭🍭🍭🍭🍭🍭🍭🍭🍭🍭🍭🍭🍭🍭🍭🍭🍭🍭🍭🍭🍭🍭🍭🍭🍭🍭🍭🍭🍭🍭🍭🍭🍭🍭🍭🍭🍭🍭🍭🍭🍭🍭🍭🍭🍭🍭🍭🍭🍭🍭🍭🍭🍭🍭🍭🍭🍭🍭🍭🍭🍭🍭🍭🍭🍭🍭🍭🍭🍭🍭🍭🍭🍭🍭🍭🍭🍭🍭🍭🍭🍭🍭🍭🍭🍭🍭🍭🍭🍭🍭🍭🍭🍭🍭🍭🍭🍭🍭🍭🍭🍭🍭🍭🍭🍭🍭🍭🍭🍭🍭🍭🍭🍭🍭🍭🍭🍭🍭🍭🍭🍭🍭🍭🍭🍭🍭🍭🍭🍭🍭🍭🍭🍭🍭🍭🍭🍭🍭🍭🍭🍭🍭🍭🍭🍭🍭🍭🍭🍭🍭🍭🍭🍭🍭🍭🍭🍭🍭🍭🍭🍭🍭🍭🍭🍭🍭🍭🍭🍭🍭🍭🍭🍭🍭🍭🍭🍭🍭🍭🍭🍭🍭🍭🍭🍭🍭🍭🍭🍭🍭🍭🍭🍭🍭🍭🍭🍭🍭🍭🍭🍭🍭🍭🍭🍭🍭🍭🍭🍭🍭🍭🍭🍭🍭🍭🍭🍭🍭🍭🍭🍭🍭🍭🍭🍭🍭🍭🍭🍭🍭🍭🍭🍭🍭🍭🍭🍭🍭🍭🍭🍭🍭🍭🍭🍭🍭🍭🍭🍭🍭🍭🍭🍭🍭🍭🍭🍭🍭🍭🍭🍭🍭🍭🍭🍭🍭🍭🍭🍭🍭🍭🍭🍭🍭🍭🍭🍭🍭🍭🍭🍭🍭🍭🍭🍭🍭🍭🍭🍭🍭🍭🍭🍭🍭🍭🍭🍭🍭🍭🍭🍭🍭🍭🍭🍭🍭🍭🍭🍭🍭,0.0023898202925920486,0.005343042779713869,0.04024554044008255,0.008645624853670597,0.032954491674900055,0.002299922052770853,0.0013418984599411488
7504667813332716822,con mattia stanga hahahah muoio✨✨,0.6471150517463684,0.005356013309210539,0.03424374759197235,0.010784058831632137,0.026323754340410233,0.04791397228837013,0.0037906344514340162
7504667813332716822,quando parlano dopo un minuto di silenzio😭,0.002810058416798711,0.00010750249930424616,0.0016919802874326706,0.0003023086173925549,0.0009520634193904698,0.00017580256098881364,0.00013401955948211253
7504667813332716822,ma i tiktoker si conoscono tutti tra loro,0.003978649619966745,0.0028639486990869045,0.02779279462993145,0.004923561587929726,0.024715742096304893,0.001510508474893868,0.000690594082698226
7504667813332716822,"mattia stanga e kiro ebra, semplicemente il duo migliore del mondo 😂",0.0439341701567173,0.0008717194432392716,0.004784181714057922,0.018314817920327187,0.010557898320257664,0.000803000177256763,0.0004623617569450289
7504667813332716822,Appena ho visto la camicia blu passare sapevo sarebbe arrivato Mattia Stanga😌,0.009036973118782043,0.00014753582945559174,0.0029015885666012764,0.0004035990859847516,0.002776733599603176,0.0015401461860165,0.0005870542954653502
7504667813332716822,Le persone che assistono alla scena:👀👄,0.0006034519174136221,0.004426265601068735,0.03503330051898956,0.005291353445500135,0.01996236853301525,0.0018743941327556968,0.000886762049049139
7504667813332716822,mattia stangaaaaa,0.005854446906596422,0.00010223714343737811,0.0013440243201330304,0.0006708471337333322,0.0019682568963617086,0.0005200166488066316,0.00014727987581864
7529974595743681815,noo la pelucaa🙂,0.0026446294505149126,0.0006227900157682598,0.007251152768731117,0.0013135017361491919,0.007299080025404692,0.0011469245655462146,0.00032924622064456344
7529974595743681815,siiiii😍,0.0019325221655890346,6.59884317428805e-05,0.0012940537417307496,0.00012941000750288367,0.0006349067552946508,0.00022620605886913836,0.00010411856783321127
7529974595743681815,por qué llegó temprano a los vídeos de Karina y no a los de Dove Cameron?,0.0006527776131406426,0.0009111901163123548,0.010279808193445206,0.0013931937282904983,0.006740611512213945,0.0004499100905377418,0.0004600185784511268
7529974595743681815,Soy la única que piensa que a Karina le queda bien todo? 😍😍,0.0007869086693972349,5.255701034911908e-05,0.0007897384348325431,0.00013947718252893537,0.0003584164660423994,8.360017091035843e-05,8.301199704874307e-05
7529974595743681815,No eran extensiones o una peluca?,0.0010239932453259826,0.0015466358745470643,0.011818219907581806,0.001382125890813768,0.007490262389183044,0.0013558354694396257,0.0008635872509330511
7529974595743681815,"sabías que Lionel Messi, Cristiano Ronaldo, Kylian Mbappé, Neymar Jr, Erling Haaland, Karim Benzema, Zinédine Zidane, Diego Maradona, Pelé, Johan Cruyff, Michel Platini, Franz Beckenbauer, Ronaldo Nazário, Ronaldinho, Rivaldo, Thierry Henry, Samuel Eto'o, Roberto Carlos, Cafu, Paolo Maldini, Alessandro Del Piero, Andrea Pirlo, Francesco Totti, Gennaro Gattuso, David Beckham, Ryan Giggs, Eric Cantona, George Best, Peter Schmeichel, Ruud van Nistelrooy, Edwin van der Sar, Raul Gonzalez Blanco, Fernando Hierro, Iker Casillas, Xavi Hernandez, Andrés Iniesta, Luka Modric, Kevin De Bruyne, Mohamed Salah, Sadio Mané, Robert Lewandowski, Luis Suarez, Antoine Griezmann, Paul Pogba, N’Golo Kanté, Casemiro, Vinícius Júnior, Jude Bellingham, Gavi, Pedri, Rodri, Phil Foden, Virgil van Dijk, Sergio Ramos, Thiago Silva, Alisson Becker, Jan Oblak, Thibaut Courtois, Gianluigi Donnarumma, Achraf Hakimi, Andrew Robertson, Trent Alexander-Arnold, Joshua Kimmich, Alphonso Davies, Raphaël Varane, Dayot Upamecano, Jules Koundé, Harry Maguire, Harry Kane, Son Heung-min, Paulo Dybala, Lautaro Martinez, Angel Di Maria, Victor Osimhen, Federico Chiesa, Dusan Vlahovic, Marcus Rashford, Jadon Sancho, Jamal Musiala, Bruno Fernandes, Jorginho, Nicolò Barella, Milan Skriniar, Matthijs de Ligt, Leonardo Bonucci, Giorgio Chiellini, Benjamin Pavard, Theo Hernández, Reece James, Mason Mount, Jack Grealish, Raheem Sterling, Hakim Ziyech, Riyad Mahrez, Ansu Fati, Ferran Torres, Memphis Depay, Álvaro Morata, Aurélien Tchouaméni, Eduardo Camavinga, Adrien Rabiot, Marco Verratti, Marcelo Brozovic, Franck Kessié, Sandro Tonali, Sergej Milinkovic-Savic, Romelu Lukaku, Olivier Giroud, Zlatan Ibrahimovic, Edin Dzeko, Randal Kolo Muani, Christopher Nkunku, Ousmane Dembélé, Kingsley Coman, Moussa Diaby, Ilkay Gündogan, Marcel Sabitzer, Dani Alves, Sergio Busquets, Gerard Piqué, Jordi Alba, Dani Carvajal, Anthony Modeste, Cody Gakpo, Mohammed Kudus, Antony Matheus dos Santos, Richarlison, Lucas Paquetá, Ederson Moraes, Édouard Mendy, Keylor Navas, Leonardo Spinazzola, Emerson Palmieri, Denzel Dumfries, Marc Cucurella, Ivan Perisic, André-Frank Zambo Anguissa, Dani Olmo juegan al ⚽ futbol",0.00121354463044554,0.0030290023423731327,0.01602853089570999,0.002062514889985323,0.016876578330993652,0.0010843483032658696,0.0004929739516228437
7529974595743681815,Procede a cortarse las extensiones,0.018900273367762566,0.002882390981540084,0.019960932433605194,0.0018392956117168069,0.012042609043419361,0.01544803287833929,0.0034053463023155928
7529974595743681815,La peluca: Ella jura 🙄,0.006355410907417536,0.00011812335287686437,0.001544978586025536,0.00017611765360925347,0.001168059534393251,0.0017135090893134475,0.0010464206570759416
7529974595743681815,nooo tu cabello oooooo me gustaba mucho pero igual te queda muy bien 😍,0.005724381655454636,0.00019248189346399158,0.005982961505651474,0.00026185408933088183,0.002575387479737401,0.00024003766884561628,0.00041171538759954274
7529974595743681815,agas lo q agas eres gpaaa,0.4828406572341919,0.004491325933486223,0.04582231864333153,0.009206220507621765,0.04770544916391373,0.0036247908137738705,0.005149431526660919
7529189388408917270,Est-ce qu’Anna esquive la veillée ou est-ce qu’elle y va pour se faire des amis ? 😁,0.0037034086417406797,7.610501779709011e-05,0.001538525684736669,0.00013543294335249811,0.0010730011854320765,0.00045082587166689336,0.0007315381662920117
7529189388408917270,Pk t’es la seul en maillot,0.08135727792978287,0.0004466926911845803,0.012685656547546387,0.0012527656508609653,0.03066917508840561,0.0004007707757409662,0.0005959637346677482
7529189388408917270,C’est quoi une veillée,0.21281643211841583,0.0004358137084636837,0.053573813289403915,0.00239115534350276,0.08656869828701019,0.0005912353517487645,0.0015434266533702612
7529189388408917270,1 minutes de silence pour Mehdi,0.0012060829903930426,0.0005890254396945238,0.005101279821246862,0.0010854850988835096,0.004732291214168072,0.0006818089168518782,0.00018663087394088507
7529189388408917270,Shayvise je t’adore répond moi je suis ta plus grande fans ❤️❤️❤️❤️❤️❤️❤️❤️❤️❤️❤️❤️❤️,0.0035828840918838978,0.0001945504773175344,0.0031792300287634134,0.0004834790888708085,0.0015041270526126027,0.00017372958245687187,0.0002136576222255826
7529189388408917270,Et du coup la suite avec Wiliam,0.0009276633500121534,0.0009059648145921528,0.009930969215929508,0.0011816195910796523,0.007022105157375336,0.0007803998305462301,0.0004233339277561754
7529189388408917270,Faut aller aller à la veiller elle va tout réussir,0.0033334707841277122,5.633932232740335e-05,0.000726560247130692,0.00010637275408953428,0.0011137807741761208,0.00032061449019238353,0.000291152362478897
7529189388408917270,Pk ils ont tous le mm maillot et pas elle alors que dans l'autre épisode les meufs montraient des maillots incr pr aller surf😭,0.012721863575279713,0.00018491127411834896,0.004488785285502672,0.0011344002559781075,0.004747339989989996,0.00016055254673119634,0.0008728900575079024
7529189388408917270,Pourquoi il y a que elle en maillot de bain alors que les filles sont censés être aussi en maillot de bain mm si elle est à moitié en maillot de bain,0.018792549148201942,0.00036282933433540165,0.007872043177485466,0.0013325167819857597,0.003691432299092412,0.0005256093572825193,0.008203654550015926
7529189388408917270,Pk y a tout le monde en combi et pas Anna ?,0.0008934243815019727,0.0004151055763941258,0.005613263696432114,0.0006447366904467344,0.0033476697281003,0.00025265844305977225,0.00023212953237816691
7529189388408917270,Est-ce qu’Anna esquive la veillée ou est-ce qu’elle y va pour se faire des amis ? 😁,0.0037034086417406797,7.610501779709011e-05,0.001538525684736669,0.00013543294335249811,0.0010730011854320765,0.00045082587166689336,0.0007315381662920117
7529189388408917270,Pk t’es la seul en maillot,0.08135727792978287,0.0004466926911845803,0.012685656547546387,0.0012527656508609653,0.03066917508840561,0.0004007707757409662,0.0005959637346677482
7529189388408917270,1 minutes de silence pour Mehdi,0.0012060829903930426,0.0005890254396945238,0.005101279821246862,0.0010854850988835096,0.004732291214168072,0.0006818089168518782,0.00018663087394088507
7529189388408917270,C’est quoi une veillée,0.21281643211841583,0.0004358137084636837,0.053573813289403915,0.00239115534350276,0.08656869828701019,0.0005912353517487645,0.0015434266533702612
7529189388408917270,Shayvise je t’adore répond moi je suis ta plus grande fans ❤️❤️❤️❤️❤️❤️❤️❤️❤️❤️❤️❤️❤️,0.0035828840918838978,0.0001945504773175344,0.0031792300287634134,0.0004834790888708085,0.0015041270526126027,0.00017372958245687187,0.0002136576222255826
7529189388408917270,Et du coup la suite avec Wiliam,0.0009276633500121534,0.0009059648145921528,0.009930969215929508,0.0011816195910796523,0.007022105157375336,0.0007803998305462301,0.0004233339277561754
7529189388408917270,Faut aller aller à la veiller elle va tout réussir,0.0033334707841277122,5.633932232740335e-05,0.000726560247130692,0.00010637275408953428,0.0011137807741761208,0.00032061449019238353,0.000291152362478897
7529189388408917270,Pk ils ont tous le mm maillot et pas elle alors que dans l'autre épisode les meufs montraient des maillots incr pr aller surf😭,0.012721863575279713,0.00018491127411834896,0.004488785285502672,0.0011344002559781075,0.004747339989989996,0.00016055254673119634,0.0008728900575079024
7529189388408917270,Pourquoi il y a que elle en maillot de bain alors que les filles sont censés être aussi en maillot de bain mm si elle est à moitié en maillot de bain,0.018792549148201942,0.00036282933433540165,0.007872043177485466,0.0013325167819857597,0.003691432299092412,0.0005256093572825193,0.008203654550015926
7529189388408917270,Pk y a tout le monde en combi et pas Anna ?,0.0008934243815019727,0.0004151055763941258,0.005613263696432114,0.0006447366904467344,0.0033476697281003,0.00025265844305977225,0.00023212953237816691
7527750945023790358,Lamine Yamal Birthday Party 😭,0.0006483880570158362,6.708905129926279e-05,0.0007684998563490808,0.00017619188292883337,0.00036387823638506234,8.020639506867155e-05,5.4690255637979135e-05
7527750945023790358,The ticket on the pants😭😭😭 He didnt buy them😭💔💔,0.0005070161423645914,2.1283931346260943e-05,0.000131212713313289,0.00010496341565158218,0.00017818021296989173,4.1326016798848286e-05,2.231638973171357e-05
7527750945023790358,future billionaires liked this comment 💸🤑,0.0005007986910641193,2.229613710369449e-05,0.00014657489373348653,9.146215597866103e-05,0.00027751136803999543,3.396613828954287e-05,1.8795879441313446e-05
7527750945023790358,future billionaires liked my comment,0.0008347513503395021,2.2375610569724813e-05,0.00021127609943505377,9.90383923635818e-05,0.00046405111788772047,3.48349531122949e-05,2.1674732124665752e-05
7527750945023790358,𝗛𝗮𝗹𝗮 𝗠𝗮𝗱𝗿𝗶𝗱 𝗛𝗮𝗹𝗮 𝗠𝗮𝗱𝗿𝗶𝗱 𝗛𝗮𝗹𝗮 𝗠𝗮𝗱𝗿𝗶𝗱 𝗛𝗮𝗹𝗮 𝗠𝗮𝗱𝗿𝗶𝗱 𝗛𝗮𝗹𝗮 𝗠𝗮𝗱𝗿𝗶𝗱 𝗛𝗮𝗹𝗮 𝗠𝗮𝗱𝗿𝗶𝗱 𝗛𝗮𝗹𝗮 𝗠𝗮𝗱𝗿𝗶𝗱 𝗛𝗮𝗹𝗮 𝗠𝗮𝗱𝗿𝗶𝗱 𝗛𝗮𝗹𝗮 𝗠𝗮𝗱𝗿𝗶𝗱 𝗛𝗮𝗹𝗮 𝗠𝗮𝗱𝗿𝗶𝗱 𝗛𝗮𝗹𝗮 𝗠𝗮𝗱𝗿𝗶𝗱 𝗛𝗮𝗹𝗮 𝗠𝗮𝗱𝗿𝗶𝗱 𝗛𝗮𝗹𝗮 𝗠𝗮𝗱𝗿𝗶𝗱 𝗛𝗮𝗹𝗮 𝗠𝗮𝗱𝗿𝗶𝗱 𝗛𝗮𝗹𝗮 𝗠𝗮𝗱𝗿𝗶𝗱 𝗛𝗮𝗹𝗮 𝗠𝗮𝗱𝗿𝗶𝗱 𝗛𝗮𝗹𝗮 𝗠𝗮𝗱𝗿𝗶𝗱 𝗛𝗮𝗹𝗮 𝗠𝗮𝗱𝗿𝗶𝗱 𝗛𝗮𝗹𝗮 𝗠𝗮𝗱𝗿𝗶𝗱 𝗛𝗮𝗹𝗮 𝗠𝗮𝗱𝗿𝗶𝗱 𝗛𝗮𝗹𝗮 𝗠𝗮𝗱𝗿𝗶𝗱 𝗛𝗮𝗹𝗮 𝗠𝗮𝗱𝗿𝗶𝗱 𝗛𝗮𝗹𝗮 𝗠𝗮𝗱𝗿𝗶𝗱 𝗛𝗮𝗹𝗮 𝗠𝗮𝗱𝗿𝗶𝗱 𝗛𝗮𝗹𝗮 𝗠𝗮𝗱𝗿𝗶𝗱 𝗛𝗮𝗹𝗮 𝗠𝗮𝗱𝗿𝗶𝗱 𝗛𝗮𝗹𝗮 𝗠𝗮𝗱𝗿𝗶𝗱 𝗛𝗮𝗹𝗮 𝗠𝗮𝗱𝗿𝗶𝗱 𝗛𝗮𝗹𝗮 𝗠𝗮𝗱𝗿𝗶𝗱 𝗛𝗮𝗹𝗮 𝗠𝗮𝗱𝗿𝗶𝗱 𝗛𝗮𝗹𝗮 𝗠𝗮𝗱𝗿𝗶𝗱 𝗛𝗮𝗹𝗮 𝗠𝗮𝗱𝗿𝗶𝗱 𝗛𝗮𝗹𝗮 𝗠𝗮𝗱𝗿𝗶𝗱 𝗛𝗮𝗹𝗮 𝗠𝗮𝗱𝗿𝗶𝗱 𝗛𝗮𝗹𝗮 𝗠𝗮𝗱𝗿𝗶𝗱 𝗛𝗮𝗹𝗮 𝗠𝗮𝗱𝗿𝗶𝗱 𝗛𝗮𝗹𝗮 𝗠𝗮𝗱𝗿𝗶𝗱 𝗛𝗮𝗹𝗮 𝗠𝗮𝗱𝗿𝗶𝗱 𝗛𝗮𝗹𝗮 𝗠𝗮𝗱𝗿𝗶𝗱 𝗛𝗮𝗹𝗮 𝗠𝗮𝗱𝗿𝗶𝗱 𝗛𝗮𝗹𝗮 𝗠𝗮𝗱𝗿𝗶𝗱 𝗛𝗮𝗹𝗮 𝗠𝗮𝗱𝗿𝗶𝗱 𝗛𝗮𝗹𝗮 𝗠𝗮𝗱𝗿𝗶𝗱 𝗛𝗮𝗹𝗮 𝗠𝗮𝗱𝗿𝗶𝗱 𝗛𝗮𝗹𝗮 𝗠𝗮𝗱𝗿𝗶𝗱 𝗛𝗮𝗹𝗮 𝗠𝗮𝗱𝗿𝗶𝗱 𝗛𝗮𝗹𝗮 𝗠𝗮𝗱𝗿𝗶𝗱 𝗛𝗮𝗹𝗮 𝗠𝗮𝗱𝗿𝗶𝗱 𝗛𝗮𝗹𝗮 𝗠𝗮𝗱𝗿𝗶𝗱 𝗛𝗮𝗹𝗮 𝗠𝗮𝗱𝗿𝗶𝗱 𝗛𝗮𝗹𝗮 𝗠𝗮𝗱𝗿𝗶𝗱 𝗛𝗮𝗹𝗮 𝗠𝗮𝗱𝗿𝗶𝗱 𝗛𝗮𝗹𝗮 𝗠𝗮𝗱𝗿𝗶𝗱 𝗛𝗮𝗹𝗮 𝗠𝗮𝗱𝗿𝗶𝗱 𝗛𝗮𝗹𝗮 𝗠𝗮𝗱𝗿𝗶𝗱 𝗛𝗮𝗹𝗮 𝗠𝗮𝗱𝗿𝗶𝗱 𝗛𝗮𝗹𝗮 𝗠𝗮𝗱𝗿𝗶𝗱 𝗛𝗮𝗹𝗮 𝗠𝗮𝗱𝗿𝗶𝗱 𝗛𝗮𝗹𝗮 𝗠𝗮𝗱𝗿𝗶𝗱 𝗛𝗮𝗹𝗮 𝗠𝗮𝗱𝗿𝗶𝗱 𝗛𝗮𝗹𝗮 𝗠𝗮𝗱𝗿𝗶𝗱 𝗛𝗮𝗹𝗮 𝗠𝗮𝗱𝗿𝗶𝗱 𝗛𝗮𝗹𝗮 𝗠𝗮𝗱𝗿𝗶𝗱 𝗛𝗮𝗹𝗮 𝗠𝗮𝗱𝗿𝗶𝗱 𝗛𝗮𝗹𝗮 𝗠𝗮𝗱𝗿𝗶𝗱 𝗛𝗮𝗹𝗮 𝗠𝗮𝗱𝗿𝗶𝗱 𝗛𝗮𝗹𝗮 𝗠𝗮𝗱𝗿𝗶𝗱 𝗛𝗮𝗹𝗮 𝗠𝗮𝗱𝗿𝗶𝗱 𝗛𝗮𝗹𝗮 𝗠𝗮𝗱𝗿𝗶𝗱 𝗛𝗮𝗹𝗮 𝗠𝗮𝗱𝗿𝗶𝗱 𝗛𝗮𝗹𝗮 𝗠𝗮𝗱𝗿𝗶𝗱 𝗛𝗮𝗹𝗮 𝗠𝗮𝗱𝗿𝗶𝗱 𝗛𝗮𝗹𝗮 𝗠𝗮𝗱𝗿𝗶𝗱 𝗛𝗮𝗹𝗮 𝗠𝗮𝗱𝗿𝗶𝗱 𝗛𝗮𝗹𝗮 𝗠𝗮𝗱𝗿𝗶𝗱 𝗛𝗮𝗹𝗮 𝗠𝗮𝗱𝗿𝗶𝗱 𝗛𝗮𝗹𝗮 𝗠𝗮𝗱𝗿𝗶𝗱 𝗛𝗮𝗹𝗮 𝗠𝗮𝗱𝗿𝗶𝗱 𝗛𝗮𝗹𝗮 𝗠𝗮𝗱𝗿𝗶𝗱 𝗛𝗮𝗹𝗮 𝗠𝗮𝗱𝗿𝗶𝗱 𝗛𝗮𝗹𝗮 𝗠𝗮𝗱𝗿𝗶𝗱 𝗛𝗮𝗹𝗮 𝗠𝗮𝗱𝗿𝗶𝗱 𝗛𝗮𝗹𝗮 𝗠𝗮𝗱𝗿𝗶𝗱 𝗛𝗮𝗹𝗮 𝗠𝗮𝗱𝗿𝗶𝗱 𝗛𝗮𝗹𝗮 𝗠𝗮𝗱𝗿𝗶𝗱 𝗛𝗮𝗹𝗮 𝗠𝗮𝗱𝗿𝗶𝗱 𝗛𝗮𝗹𝗮 𝗠𝗮𝗱𝗿𝗶𝗱 𝗛𝗮𝗹𝗮 𝗠𝗮𝗱𝗿𝗶𝗱 𝗛𝗮𝗹𝗮 𝗠𝗮𝗱𝗿𝗶𝗱 𝗛𝗮𝗹𝗮 𝗠𝗮𝗱𝗿𝗶𝗱 𝗛𝗮𝗹𝗮 𝗠𝗮𝗱𝗿𝗶𝗱 𝗛𝗮𝗹𝗮 𝗠𝗮𝗱𝗿𝗶𝗱 𝗛𝗮𝗹𝗮 𝗠𝗮𝗱𝗿𝗶𝗱 𝗛𝗮𝗹𝗮 𝗠𝗮𝗱𝗿𝗶𝗱 𝗛𝗮𝗹𝗮 𝗠𝗮𝗱𝗿𝗶𝗱 𝗛𝗮𝗹𝗮 𝗠𝗮𝗱𝗿𝗶𝗱 𝗛𝗮𝗹𝗮 𝗠𝗮𝗱𝗿𝗶𝗱 𝗛𝗮𝗹𝗮 𝗠𝗮𝗱𝗿𝗶𝗱 𝗛𝗮𝗹𝗮 𝗠𝗮𝗱𝗿𝗶𝗱,0.00201729079708457,0.00043690126040019095,0.0036178191658109426,0.0006909045041538775,0.004819490015506744,0.0002630238304845989,0.0003788476751651615
7527750945023790358,Lamine Yamal 10 🔥💙❤️,0.0005219533341005445,5.905386933591217e-05,0.0005423410912044346,0.00015076249837875366,0.00032941135577857494,9.198976476909593e-05,4.962695311405696e-05
7527750945023790358,why is nobody reading my name 🔥,0.0017483897972851992,4.88398945890367e-05,0.00041985834832303226,0.00031529017724096775,0.0003478718863334507,6.291493627941236e-05,3.313178604003042e-05
7527750945023790358,"Barça 6-1 Real, Barça 5-0 Real, Barça 5-0 Real, Barça 5-0 Real, Real 0-4 Barça, Barça 5-2 Real, Barça 3-2 Real, Barça 4-3 Real, Barça 3-0 Real, Barça 2-0 Real, Barça 1-0 Real, Barça 2-1 Real, Barça 3-1 Real, Barça 4-0 Real, Barça 3-2 Real, Barça 2-1 Real, Barça 1-0 Real, Barça 3-1 Real, Barça 4-2 Real, Barça 3-0 Real, Barça 2-0 Real, Barça 2-1 Real, Barça 3-0 Real, Barça 3-1 Real, Barça 2-1 Real, Barça 3-0 Real, Barça 5-1 Real, Barça 4-0 Real, Barça 3-0 Real, Barça 1-0 Real, Barça 2-0 Real, Barça 3-2 Real, Barça 4-1 Real, Barça 3-1 Real, Barça 2-1 Real, Barça 1-0 Real, Barça 3-0 Real, Barça 2-1 Real, Barça 2-0 Real, Barça 3-1 Real, Barça 5-0 Real, Barça 4-2 Real, Barça 3-2 Real, Barça 2-1 Real, Barça 1-0 Real, Barça 3-1 Real, Barça 4-3 Real, Barça 2-0 Real, Barça 3-0 Real, Barça 2-1 Real, Barça 3-1 Real, Barça 4-0 Real, Barça 5-1 Real, Barça 3-2 Real, Barça 2-0 Real, Barça 1-0 Real, Barça 3-0 Real, Barça 4-2 Real, Barça 3-1 Real, Barça 2-1 Real, Barça 3-0 Real, Barça 5-0 Real, Barça 4-0 Real, Barça 3-2 Real, Barça 2-1 Real, Barça 1-0 Real, Barça 3-1 Real, Barça 4-2 Real, Barça 3-0 Real, Barça 2-1 Real, Barça 3-0 Real, Barça 5-1 Real, Barça 4-3 Real, Barça 3-2 Real, Barça 2-1 Real, Barça 1-0 Real, Barça 3-1 Real, Barça 4-0 Real, Barça 3-2 Real, Barça 2-1 Real, Barça 1-0 Real, Barça 3-0 Real, Barça 4-2 Real, Barça 3-1 Real, Barça 2-1 Real, Barça 3-0 Real, Barça 5-0 Real, Barça 4-2 Real, Barça 3-1 Real, Barça 2-0 Real, Barça 3-1 Real, Barça 4-0 Real, Barça 3-0 Real, Barça 2-1 Real, Barça 3-1 Real, Barça 4-3 Real, Barça 3-2 Real, Barça 2-1 Real 🤫",0.0007345788180828094,0.0015194222796708345,0.018025677651166916,0.0011616848642006516,0.009753110818564892,0.0005989947239868343,0.0008826050325296819
7527750945023790358,Messi 🥺💔👑 lamine yamal 🤩❤️👑 [photo],0.0006058310973457992,0.0025651617906987667,0.018493380397558212,0.0028266313020139933,0.01020610611885786,0.0012446180917322636,0.0005865274579264224
7527750945023790358,ain't no party like a lamine yamal party 💔🙏,0.001353928935714066,1.7686708815745078e-05,0.00015550210082437843,0.00013441668124869466,0.00041444352245889604,4.8278561735060066e-05,2.3169395717559382e-05
7529542416383184150,Stop✍falling✍in✍love✍with✍every✍boy✍you✍see✍on✍tiktok✍because✍they✍don't✍know✍ you✍exist✍,0.0013212683843448758,6.572504207724705e-05,0.0004644879372790456,0.00018761272076517344,0.0004713706730399281,7.018643373157829e-05,6.274249608395621e-05
7529542416383184150,"""sushi don't lie""",0.0029005613178014755,6.604238296858966e-05,0.0014224550686776638,0.00017509858298581094,0.0009200247586704791,9.459638386033475e-05,0.0002639714512042701
7529542416383184150,me when namdol: [photo],0.0017285081557929516,0.00064141268376261,0.006305753719061613,0.0016562513774260879,0.0029449863359332085,0.0003747393493540585,0.0001574814523337409
7529542416383184150,ngl I feel like he owns this song😭,0.002067413181066513,8.342910587089136e-05,0.0007876442396081984,0.00048249802784994245,0.00048298531328327954,8.933911158237606e-05,4.427726526046172e-05
7529542416383184150,namdol ice bucket challenge [photo],0.0005161741282790899,0.00015362068370450288,0.0015745628625154495,0.0003088473167736083,0.0012270321603864431,0.00011419063957873732,0.00010203720012214035
7529542416383184150,he's the first coming to my mind when I hear this sound,0.0018424566369503736,2.246104304504115e-05,0.0002548598567955196,0.00013361034507397562,0.0004746463382616639,3.776742596528493e-05,2.796276930894237e-05
7529542416383184150,"○ falling in love
○ married
● in love with boy on tiktok that I don't have a chance",0.015489366836845875,0.00021177830058149993,0.0052218688651919365,0.0003984372888226062,0.0008615826372988522,0.0002821370726451278,0.0039866468869149685
7529542416383184150,איזה חטיףףף💋❤️,0.0005968957557342947,0.0017754201544448733,0.015932492911815643,0.0024891153443604708,0.01241474412381649,0.000899237347766757,0.0004981313832104206
7529542416383184150,why's bros teeth so white,0.036110688000917435,0.00010501558426767588,0.00036567053757607937,0.015986913815140724,0.006048792041838169,0.00015825548325665295,0.00012440043792594224
7528936530925112589,Todos:Mujer de buena pasta embarazada 😱. Yo:como corría carlos JAJAJAA,0.028229637071490288,0.0003686706186272204,0.004352142568677664,0.0022802220191806555,0.004229072481393814,0.0004890693235211074,0.006221882067620754
7528936530925112589,"Yo biendo este video después de q vi el video de mujer buena pasta, q esta embarazada",0.026165008544921875,0.00028540988569147885,0.00337963062338531,0.0029502566903829575,0.003141620196402073,0.0006872509839013219,0.008259637281298637
